"Labeled Data","Final Label"
"Jacovia works well with others and has demonstrated the ability to use others' strengths to complete tasks.
","STF"
"She encouraged her residents (members of the Wellness LLC) to be well and take part in different wellness opportunities on campus.
","STF"
"Jake is a leader!","NA"
"Jake is easy to work with and communicates well.","NA"
"Jasmine found it hard to share assignments with other interns and student staff.","NA"
"Jenna did a great job of leading, but she could work on being a stronger leader and ensuring the members do their parts.
","STC"
"Jenna possesses a great deal of potential for leadership within our internship group.","NA"
"I think her vision and work ethic during projects would benefit the group as a whole, and I am interested in seeing her help other interns gain skills they don't currently possess.","TF"
"All of the pieces and components are there, but I want to see how they come together in future semesters at the Watt Center.
","NA"
"She does a wonderful job at leading the office and working with newer interns to meet goals and objectives!
","TC"
"She was an amazing asset to our team, but I would love to see her excel in leadership.","NA"
"Jillian does good work when given very specific tasks.
","NA"
"Hopefully, he will have the chance in the future.
","NA"
"John still has a lot to learn in terms of leadership.","NA"
"Jonathan has the ability to take initiative and lead very well.
","NA"
"Jordan is incredibly bright and talented.","NA"
"At times she seemed to lack the confidence to dig deep into projects.","NA"
"I valued Jordan's work ethic and would expect given more time in our organization she would gain the confidence needed to tackle larger projects and take on additional responsibilities.
","NA"
"She could look for places to take initiatives.
","NA"
"Joseph should take the initiative in leading.
","NA"
"Julia has done a great job working with us.","NA"
"This presented her with some challenges as she led a group of undergraduates from diverse fields in analyzing qualitative data.
","NA"
"Many of her peers have years of experience doing what they do, so it can be tough for an intern to step in and become a leader among them.","NA"
"Justin has great technical skills and knowledge, is adaptable and resilient and a reliable worker.","NA"
"Katie has all the necessary skills to move to the next level, and begin to explore leadership roles in organizations she is involved in.
","NA"
"I know that is a big statement.","NA"
"But it is also appropriate.","NA"
"She has been great at working directly with people.","IDK"
"She excels in her efforts (and success) in hiring, training and coaching new employees.","STF"
"She is also great at keeping a level head when conflict arises and works to make sure that she understands things from the other person's perspective before she acts.","STF"
"When it comes to management, she exhibits strong leadership skills that will serve her well in life. 
","NA"
"We plan on training him to be one of our mentors, working more with our incoming underrepresented STEM freshmen.
","NA"
"Kendal led well","NA"
"Kimberly worked well with her mentees in guiding them to get involved with campus activities.
","STF"
"Laycee managed 6-7 people this summer.","STC"
"She was not afraid to take on hard tasks and make schedules work.","NA"
"She took on projects head on and got them finished.","NA"
"Leadership - Madi is a great leader but if she can take her charisma, drive, and energy, and find away to replicate that in other humans, she will change the world.
","IDK"
"Andrew has show growth potential in leadership
","NA"
"2nd year working for me and helped teach others
","STF"
"Leadership is a difficult talent which requires practice if not innate.","NA"
"Leadership is a field where I feel he needs to improve.","NA"
"Leadership is a quality BMW expects from all of it's associates and would be an area for development.","NA"
"She works hard in the office and is willing to help outside of the office.","NA"
"She is already on a path to grow as a leader by being involved in so many campus organizations, particularly the Chapman Scholars Leadership Program.","NA"
"I know that Kiah will accomplish great things as a student leader and beyond.
","NA"
"Leadership is Michael's greatest area for and opportunity for improvement, especially in regards to intentional collaboration with fellow interns; communicating his leadership role and qualities will be vital to partnering with the other returning intern next semester.
","NA"
"Leadership is very important in all companies.","NA"
"Liana improved her leadership.
","NA"
"I think through time, Kelly will improve and attain leaderships skills needed to manage and coordinate projects.
","NA"
"Leadership skills often increase with time spent in professional environments.","NA"
"Leadership was selected only because of limited opportunity for leadership as an intern over a summer.
","NA"
"Leadership, because this is a necessary trait to manage the student shop
","NA"
"Leadership-Was unable to assess
","NA"
"Leads the autonomy team; provides coherence and instills rigor into the team
","IDK"
"Leads the IC engine team.","NA"
"Makes sure things get done and keeps the entire team motivated.
","STF"
"Lillian has evolved into an outstanding leader.","NA"
"She has typically been very quiet for years but in the last year she has risen into this huge calm abiding force for good.","NA"
"During the internship we made it a point to expose her to leadership improvement opportunities.","NA"
"Mackenzie is excellent at utilizing others strengths to achieve a vision and goal
","TF"
"So she did not have the opportunity to demonstrate team-building leadership skills with any collaborators.","NA"
"and she will need to be a mentor for both of them, identifying their skills and helping me utilize them in the office operations and her specific event planning duties.","TF"
"I look forward to seeing those efforts unfold.
","NA"
"Maggi has the potential to be a great leader.","NA"
"At this point in her development, she simply hasn't had the same amount of practice in this area as she has in other areas.","NA"
"Maggy has not had a ton of opportunity thus far to showcase her leadership.","NA"
"Hopefully, we can find areas for her to step up and continue to grow in this area.
","NA"
"I would recommend to improve it more and more.
","NA"
"Maren is a great leader but could continue to grown in her leadership as she develops the ability find a utilize the strengths of everyone in whichever group setting she is in.
","IDK"
"Armoni is so used to having to rely only on herself to accomplish her goals that she sometimes has an expectation that others will fail to follow through.
","NA"
"She can improve on encouraging and motivating her peers, and on interacting with them to express her enjoyment of their being on the team with her.","NA"
"She also struggled with following rules relating to no texting or using smart phones while in the office at your desk, despite having received those rules clearly in writing and verbally.
","NA"
"She has excellent people skills and is very adept at networking with others to complete assignments.
","NA"
"Mary took responsibility for and excelled at leading a team of student workers.","NA"
"Matthew is a Sophomore, and he is new to a leadership position.","NA"
"He struggled to meet the 160 hour commitment this semester.","NA"
"He has the potential to be a strong leader, so this UPIC internship was very valuable for him.","NA"
"She organized all the events and made sure she increased the downloads.
","NA"
"McKenna has wonderful leadership qualities that I've been able to witness during my time with her, but I see a lot more potential for her to emerge as a leader among her peers.","NA"
"She was able to see a need and bring groups together and help solve problems.
","TF"
"Her professionalism, strong ability to lead meetings, and creativity has led her to have an important role in our department.
","IDK"
"As a single co-op in our lab, William did not have much of an opportunity to demonstrate his leadership potential.","NA"
"but he did not have a chance to demonstrate that.
","NA"
"Melissa has grown a lot in her leadership abilities over the last semester and continues to improve every day.","NA"
"She became a certified DTTAC Diabetes Prevention Program Lifestyle Coach and was able to facilitate sessions on her own.","NA"
"Over the last semester she has led several one-on-one and group class sessions.","NA"
"Melissa was placed in a leadership position this semester and really embraced the role.","IDK"
"She was like a mentor to the interns that reported to her and really excelled in leading them to a successful semester.
","NA"
"Mihir needs to improve leadership decision making capabilities.","NA"
"However, these abilities of his were not tested because he was in a junior role.
","NA"
"While she handled herself pretty well, she will likely further develop her leadership skills as she has more opportunities to practice leading.
","NA"
"more comfortable following
","NA"
"Morgan has the knowledge base to manage other areas (depts) involved in her scope of work.","IDK"
"She should work to become a leader by gaining the confidence needed to delegate tasks and create a stable & successful process for all areas involved in the supply chain.
","TC"
"She is able to create and convey a plan and build a team into a successful unit.
","IDK"
"Mr. Mukherjee is a junior graduate student and has not gotten a lot of opportunities to practice and demonstrate his leadership potential.","NA"
"As a student intern, I think there is always room to grow with respect to leadership and ownership.","NA"
"However, there are a couple of projects for next semester that I am going to let her take the lead on and look forward to seeing even greater growth in this area.
","NA"
"Mr. Prasad is very intelligent but seems to be a bit shy at times.","NA"
"Ms. Dale is very intellectually aggressive and driven.
","NA"
"I have full confidence that she'll do great things for her new employer!
","NA"
"Management and corporate leadershp will recognize and reward both collaboration and leadership skills in different ways.","NA"
"My encouragement to all students is that Collaboration and Leadership skills are critical to students for long term success in this field.","NA"
"Once you have established command of a technology and are good at analyzing and solving problems, which is the fundamental element of the computer science and engineering fields, the two skills that are going to take you the farthest in your career will be collaborating/working together on the team despite the circumstances, and secondly, leadership if you want the distinction, the risks, and the rewards of both success and failure.","TC"
"n/a
","NA"
"NA
","NA"
"Hopefully she gains this maturity with experience in her PhD and beyond.
","NA"
"Namrata was not asked to lead or innovate, which could be assessed in a future position.","NA"
"I recommend that Namrata leverages her leadership education and acquires more assertiveness, she definitely could use some practice - but that was not required in this role.
","NA"
"Natalia needs to be more aggessive and less passive in her leadership skills
","NA"
"As an intern and young in the professional career, I wouldn't expect leadership to be a strength.","NA"
"Need more to be proactive in driving new ideas
","NA"
"Needs higher comfort level to get people around her excited about work, but this is very minor.
","NA"
"Nick did not have many opportunities to develop this skill
","NA"
"As a student at this point in her career, she is often executing the vision of others.","STF"
"I encourage her to seek opportunities to develop and grow her own vision in both her work and service.
","NA"
"It astounds me to think about the young lady who started here in August 2017 and to see how much she has transformed since that time.","NA"
"I dont list leadership as the greatest area for improvement because she lacks these skills; on the contrary, in the coming semesters I know she will be the best leader for the Media and Graphics team.","NA"
"As we move into the fall semester, Nicole will be taking on the role of lead intern for my Media and Graphics team.","NA"
"Nik was put into the highest leadership role early on in his time with our staff.","NA"
"No opportunity to assess this area.
","NA"
"As an intern, you are not frequently in a leadership position.","NA"
"There was not ample opportunity to demonstrate this trait.
","NA"
"None at all.","NA"
"None of these options are weaknesses for Daniel, and he is quite balanced across all of them, so its hard to choose one, and I am waffling between Collaboration and Leadership because they work together.","NA"
"Out of good collaborative experiences, strong leaders will emerge.","NA"
"Not yet experienced in this skill, however opportunity hasn't been presented.
","NA"
"Notice a willingness to work and be part of the team but nor to drive and take charge and own a specific part of the project.","NA"
"Olivia was shy at first","NA"
"but after she became comfortable in her position, she excelled and came up with her own ideas to help market our facility.
","NA"
"She is always positive and read to help everyone any way she can.
","NA"
"Once Nicole gains confidence and experience she will be a natural leader in any field she chooses.
","NA"
"Only because I do not think he was able to get a lot of leadership experience in this role.
","NA"
"only because she tended to prefer to work by herself and didn't take on a leadership role
","NA"
"only two months in the company
","NA"
"Our office hasn't given Charlotte many opportunities to have a leadership role, but, we're confident, if given, she would excel.
","NA"
"Pain & simple","NA"
"Part of the job description for this internship is that students will identify promotional/marketing needs that we lack at the Watt Center and work to fill those gaps.","NA"
"We meet regularly as a team and I check in with interns at almost every shift, but I also want the students to develop their own ideas and work with one another to bring those ideas to life.","TF"
"I feel like I spent a vast majority of the semester hand-holding and prodding her to complete projects, even after I gave her all of the materials she would need.","TC"
"I know she is very talented and theres a lot of potential for growth in the future.
","NA"
"Patrick has grown in his involvement with our PEER WISE outreach events; from being just a participant or worker to a leader.","NA"
"Students gravitate to him and he encourages them in their educational pursuits.
","STF"
"Patrick has worked well with SHPE and PEER as a mentor to help bring more awarenees of the Hispanic community and getting his mentees involved in community events and academically.
","NA"
"Quanyi is advanced in all areas, however, given the position she was in and the short time period in which I was able to observe her work, there was not much opportunity for Qianyi to show her leadership skills.","NA"
"This is the only reason why I would list it as an area for improvement.","NA"
"As Harshit progresses in his career, Leadership and team-building will be required to grow other team members and accelerate his personal growth.","NA"
"Harshit has not been in a position to demonstrate significant leadership during this term, but I'm confident he will contribute in those ways when given the opportunity.
","NA"
"Quiet and shy; but knows how to work well with others
","NA"
"Rachel is very capable and works well with others but seems to shy away from initiating a lead position.","NA"
"Rachel spearheaded many of the activities for her fellow mentors and guided her mentees with excellance
","NA"
"Reagan is diligent and I would like to see her confidence continue to improve as she works with the rest of our team.","NA"
"Reagan is pretty quiet and shy, but he is extremely knowledgeable.","NA"
"His intellect could translate into leadership down the road.
","NA"
"With her exceptional communication and collaboration skills, I think she can progress to the next level by taking leadership on projects and helping others gain the confidence that she displays.
","NA"
"Recognizing that providing others the opportunity to lead will help in their overall development.
","NA"
"She has great talent, but needs to be more vocal about her thoughts and confident in her abilities.
","NA"
"What she should focus on when she observes an opportunity is to speak up sooner.","NA"
"Robert could improve in the area of recognizing gifts and skills in others that could prove helpful to the overall vision.
","TF"
"From her experience level and history, I would think that this is an area where she needs more exposure and thus training.","NA"
"In regard to the other fields, Abele is either competent or above average for her age and experience.
","NA"
"Because he excels in every one of the competencies, I'd have to say that Leadership is the greatest strength as his mastery of this concept flows into all of the others.
","NA"
"He leads many projects for Pearce and we have come to rely on his leadership and seniority.","NA"
"We often have new interns and they look to Saavon for mentorship and guidance.","STF"
"Sally did not have any opportunities to build this skill in this internship.
","NA"
"Sarah has always been a leader on the Rowing team, however, in this internship I witnessed leadership outside of sport.","NA"
"She also should leadership to work with University leaders to secure additional funds for a speaker.","NA"
"The best part was that she took the initiative and was able to deliver.","NA"
"Sarah has really developed into one of the outstanding student leaders at Clemson.","NA"
"Her engagement with her peers as an advisor, assumption of leadership roles - both within her department and the Honors College, and regular commitment to extra- and co-curricular activities (Grand Challenges Scholars, undergraduate research, the sailing team) all helped Sarah to be an exceptional peer ambassador.","NA"
"Sarah possesses a great deal of potential in her leadership skills.","NA"
"I can already see her skills emerging in the intern department, but I have no doubts that she will continue to grow as a strong leader in future semesters.","NA"
"I really see Sarah becoming a strong guiding force for my intern team in the future.
","IDK"
"Savannah is a strong leader.","NA"
"Self-starting, positive attitude, and creative.","IDK"
"1.)","NA"
"Nic has a great attention to detail and every project he was a part of was completed above and beyond what was asked of him3.)","NA"
"Serves as DO program manager and is able to pull the entire team together
","NA"
"Additionally, I think he has the ability to become a great leader withing the Makerspace team.
","NA"
"She communicates well with other people, adapts well with any situation and new tasks, and has a great work ethic.","NA"
"She did not have an opportunity to really lead others, so I feel that this is something that can always be worked on.","NA"
"She didn't have a ton of opportunity to do this  would like to give her more next semester.
","NA"
"She has been able to expand her role as the lead intern and help me delegate tasks to others.
","STC"
"She has no intern co-workers here this summer, so I couldn't observe leadership skills but I'm sure that she has great ones in a setting with colleagues/co-workers/peers.","NA"
"I don't see this as a greatest area for improvement, but I was forced to choose one.
","NA"
"She could do an even better job to keep her group and client informed of the project status.
","NA"
"She hopes to start presenting workshops next semester, so this would be a great area for improvement!","NA"
"She is much more of a follower and could expand on her leadership skills.
","NA"
"She is not someone who speaks up or be up front and leads a group, however, she has great communication, collaboration and problem solving skills.","NA"
"She just needs to have more confidence in herself when telling people what they have to do.
","NA"
"She leads by example.","STF"
"They learned study skills, time management, and the importance of communication with faculty, UPICs and peers.
","NA"
"She works well with others, makes a good observation of people, and has a good foundation to be a great leader.","IDK"
"Shyla is a great leader.","NA"
"All of her mentees this year enjoyed her being their mentor.","NA"
"She is also not afraid to speak up and give an opinion.
","NA"
"Siddartth worked with suppliers on some critical projects.","NA"
"Sierra did an excellent job using other's strengths to help accomplish her goals.
","IDK"
"Since we could not provide any leadership experience for Sam in the intern position, I am sure he will grow as he is able to guide others in the future.","NA"
"So I didn't see a lot of this in her this semester, which is why i'm choosing it for this.","NA"
"I really think she has it in her, but I don't know that she really had an opportunity to do that this semster, either.","NA"
"However, she is very driven and focused on doing good work.
","NA"
"Sometimes I think Erika likes doing the things she likes.","NA"
"Sri will be a good leader one day, she has the ability to go far in our industry.","NA"
"Sri needs to gain more confidence in herself, which will come with experience.
","NA"
"Still needs to be able to assert his plan on his team, he works well with the management team above him.
","STC"
"Student has shown great confidence in managing projects and interacting with multiple department within the plant
","NA"
"Sydney is fully qualified to take on a leadership role and just needs to continue looking for those opportunities.","NA"
"Here biggest weakness in this area is not stepping forward and pursuing those opportunities.
","NA"
"Ashleigh could work on her leadership skills.","NA"
"Tarlan is very young and lacks experience in the work place, but has a great deal of potential to be an excellent leader
","NA"
"Taylor was not in a leadership role and so this competency was least used.
","NA"
"Teresa established herself as a leader very quickly during her time at the Watt Family Innovation Center.","NA"
"She was able to take the lead on projects and became someone I could rely on to quickly and efficiently finish tasks.","NA"
"She's not afraid to take on a diverse range of projects, from photography, to videography, to designing major pieces for our exterior light display.","NA"
"I know her technical skills and ability to collaborate with others will aid in her success wherever she works in the future.
","IDK"
"He has been assigned greater responsibility for next semester, and hopefully he will develop the leadership skills with some more experience.
","NA"
"The internship did not offer leadership opportunities so I did not get to assess Abby's leadership skills.
","NA"
"What she does within the realm of communication could be expanded upon to further recognize and capitalize upon the strengths of those she is working with.
","STF"
"The internship did not provide an opportunity for Vanessa to lead others so I am unaware of her leadership skills.
","NA"
"The only reason I suggest Leadership is because I didn't have an appropriate amount of time to measure Jake's leadership.","NA"
"The options to actually apply Leadership skills were limited in the scope of the internship, however I see this area as one that he could benefit the most to optimize efficiency in his work.
","STC"
"There was not an opportunity to fully test these skills, but that is generally an area where improvements can be made.","NA"
"There were not many opportunities for Ameya to show leadership skills due to the nature of his role.","NA"
"He may have good leadership skills but it was not necessary for his internship role.
","NA"
"In some cases this works very well, but I'd like to see her feel more comfortable and confident about taking initiative and being instigative.","NA"
"But then again, this was Savannah's last semester at Clemson","NA"
"
","NA"
"This intern position does not have much opportunity for the student to exercise her leadership.
","NA"
"So would suggest if future internship opportunities arise maybe a Leadership role would assist.
","NA"
"This is an area he'll grow inevitably as he develops in his professional career, just needs more experience which will come with time.
","NA"
"Leadership is challenging.","NA"
"She did a great job, but practice will make her more confident.
","NA"
"She will try other methods, but if she can not get them to get involved she will become frustrated.
","NA"
"Leadership is an area of consistent growth for everyone.","NA"
"This is difficult as I think Deepak is a well-rounded individual.","NA"
"This is hard because Becca possesses all of these skills.","NA"
"She needs to understand what is being asked and how to do the task, once that is understood she can easily do anything you ask her and go above and beyond.
","NA"
"Eileen could work more at leading others.","NA"
"Her comfort zone is working by herself.
","NA"
" As Ally's career progresses, I have no doubt she will be able to pull from her experiences as a student-athlete and business professional to become a great leader.
","NA"
"This is just because she wasn't really a project lead this semester","NA"
"This is mainly due to experience level and opportunities to grow leadership.","NA"
"I've started to see developments on this front recently assisting in training for new hires.","IDK"
"This is not something she is able to do a lot in this position, but in the future maybe working more closely with the other interns and GAs in the office she could take the lead on a social media campaign
","NA"
"This is partially because we don't give her the opportunity to lead others in our office, although she does a fantastic job of taking the lead on entire projects.","NA"
