"Labeled Data","Final Label"
"1 - Ability to learn new technology quickly 2 - Creativity!!!","NA"
"3 - Dependable and ability to work independently Leadership, pleasant personality/warmth, and confidence in her work. 
","NA"
"Corey can work on planning out the next phases of projects from a high level before going into the details as this will allow him to keep a tighter project schedule.","NA"
"This skill will come with experience as he develops more expertise with projects.
","NA"
"Courtney's unfamiliarity with the field kept her from exercising the confidence needed for leadership.
","NA"
"Create a vision of how an area can be better and set a program to achieve this vision.
","IDK"
"Dalvin is pretty quiet, but I feel he could be a fantastic leader given the right opportunity.","NA"
"He's smart and can figure things out quickly.
","NA"
"She can improve in encouraging input from others.
","IDK"
"Danielle didn't have many opportunities to demonstrate her leadership skills while she was with us; however, I believe she would have great skill and confidence in anything that she attempted, so continuing to develop her leadership skills when given the opportunity would be to her benefit.
","NA"
"Deepa needs to learn to share her knowledge and understanding of technology and processes to better engage others into her projects.
","NA"
"Adrian could benefit from more opportunities to learn how to apply his strengths to lead others.
","NA"
"She was able to take our work to the next level by taking the lead and forming new partnerships with groups on campus!","NA"
"Although the outcome wasn't what I was hoping (this was for our division intern project...which fell flat on the staff side, mostly, but partly on the intern side), she was willing to allow me to put her into a leadership position for a project that she wasn't initially supposed to lead, and was asked to kind of pick up the pieces and produce a product.","NA"
"Delaney has been an intern in the Studio for awhile and you can see the other interns look to her for guidance and help.","STF"
"Delaney has been tasked to complete one big project before her internship has finished and was recommended to seek out advise and insight from people in other areas of the business.","NA"
"Demonstrated great leadership with her mentees.
","NA"
"Diamond does a great job taking initiative and following through with her projects.","NA"
"Didn't have much opportunity for this
","NA"
"Displays great leadership with her mentees and guideing them in their freshman year.
","NA"
"I will be asking Allie to lead a project.
","NA"
"Ajinkya can take an active role and be a self-starter in projects which will help him develop as a leader.
","NA"
"During this semester we identified that Chip would be the best person to lead the Makerspace in the Fall, based, on part, to his leadership skills
","NA"
"Emily has always been a leader but this year grew in this area even more so being our most senior intern and serving as an example and guide to our other 4 interns.
","STF"
"Emily hasn't had the opportunity to take the lead on a significant project.","NA"
"Emma shows tremendous initiative and maturity in developing, communication and bringing to fruition her vision for Clemson's Sustainability initiatives.","IDK"
"She has outstanding leadership skills that will take her far in her career.
","NA"
"Eric was great at working independently and along with others to achieve project goals and has the capability to be a great leader.","NA"
"During his internship with us he did not take leadership over the projects he was given to bring them to success, rather he relied on others.","NA"
"Eva didn't have many opportunities to lead others while in her position.","NA"
"Even though Reilley is an excellent Cast member, she needs to learn how to lead and push her peers to do better and improve their performance.
","STC"
"She is able to see the bigger picture and long-term goals, which would serve her well in leadership roles.","NA"
"Hannah follows through on what she says she will do, she makes good decisions, and she has a great personality.","NA"
"I think she possesses many of the characteristics and qualities, now its just time for her to pull all of them together as a leader.
","NA"
"Everyone have our own personality and its good to understand the variety, but proactivity and leadership are areas that must be improved everyday, no matters what type of personality you have.","NA"
"I truly believe that improving this areas will make her a excellent professional.
","NA"
"Fewer opportunities have been provided in this area thus far.
","NA"
"Gabrielle didn't have a lot of opportunities to show off her leadership skills.
","NA"
"Great intern and a great person to work with.","NA"
"Great leader of the interior design team.","NA"
"Takes charge and does not hesitate to advance the team by collaborating with faculty and staff.
","NA"
"Good motivator.","STF"
"Brandon is punctual and on time 30 minutes early each day.","NA"
"Brandon takes on any task assigned to him with enthusiasm and completes it with great precision.
","NA"
"Hannah has successfully lead two project teams this semester.","NA"
"Alex is smart and would be a good leader.","NA"
"I believe he's an introvert who has a lot to say once you get him started, but you have to get him talking.
","NA"
"Hannah is always taking leadership initiatives within her UPIC position.","NA"
"She is given certain tasks and will go above and beyond to complete the task and also bring in additional roles.
","IDK"
"Hannah saw where improvements needed to be made in the program and took leadership over developing new solutions.
","NA"
"Hayley has great skills and just needs the experience to become a great leader.
","NA"
"He constantly impresses all of us by taking charge of his project
","NA"
"He has very successfully taken the VR Immersive Space form a concept to a reality.","NA"
"He is a natural leader.","NA"
"He takes charge and does things first.","NA"
"He is not an outgoing person so stepping into a leadership role and understanding group dynamics can be hard for Andrew.
","NA"
"He is very confident in this particular field, he was made for it.","NA"
"His work ethic, sacrifice and commitment are unheard of for a guy his age!","STC"
"Jonathan conducts himself in a professional manner and has represented Gray Engineering well.","NA"
"Jonathan has also learned to communicate with regulatory agencies and our clients when needed.
","NA"
"He is very organize, passionate toward every subject, and displays a well leadership skill.
","NA"
"He also simply wasn't given a lot of opportunity to showcase leadership skills with some of the work we did this summer.
","NA"
"He not only understands his strength and weakness, but he recognizes others' strength and weakness.","NA"
"He often waited on others to respond to tasks first.
","NA"
"He should continue to improve on his leadership skills.
","NA"
"He motivated the others to do the needed tasks and was the first to respond to requests.
","IDK"
"He thrives in a group environment, and I believe he would benefit from more leadership tasks.
","NA"
"Alexis was able to work well with her group of mentees that were from a wide range of backgrounds.","NA"
"She recognized the individual strengths that each of her mentees had and was able to use this to advance the group as a whole.
","TF"
"Her leadership skills are still strong, but has difficulty engaging others in projects.
","NA"
"His role in this internship did not specifically require the leadership skill, but it will be necessary in his future career.
","NA"
"He is a very well rounded student and did a very good job in this internship.
","NA"
"I think she will be a great leader one day, but is just getting her feet under her so she does have a lot to work on (as do we all).","NA"
"Horace displays great leadership with his mentee by guiding them in tho great academia study habits and when he sees a need of them he goesinto action.
","NA"
"However I believe that in the future if placed in these situations he could learn and grow in this area.
","NA"
"I am working at University of Texas at El Paso.","NA"
"During his stay, he performed as a leader to organize and conduct the research with several other junior researcher/students.
","STC"
"I believe as Allison gains more experience her ability to take on more leadership roles - she most definitely has the key characteristics that will allow her to be a leader.
","NA"
"She is great at working with patrons to figure out their needs, and maintains a positive attitude throughout, both of which I consider essential aspects of leadership.
","TF"
"I believe that this internship has helped her take ownership of one of our particular tools, our newsletter, as she has advocated for various updates and made it her own--and I would love to see her do this in other areas of her academic, professional, and social life.
","NA"
"I believe that I didn't provide her with enough opportunities to grow in this area.","NA"
"This will help her gain more experience in this competency.
","NA"
"I cannot answer this question and made a selection only because forced to by the software.
","NA"
"As she progresses in her education and career, I'm sure Mary Elizabeth will encounter situations in which she will embrace the chance to develop and grow as a leader.
","NA"
"I could have chosen several for LaMarr, but I chose Leadership because LaMarr has demonstrated excellent leadership skills this semester, especially with his team of Student Event Coordinators.","NA"
"His positive attitude and outlook has also been encouraging to others this semester.","STF"
"LaMarr has done a fantastic job at sharing ideas, setting goals for himself and the team and supporting others during very busy times.","IDK"
"LaMarr is only a freshmen","NA"
"so I look forward to watching (and hopefully mentoring) him as he continues to develop into an even stronger leader!
","NA"
"She definitely is a leader, and I think she would excel if given the opportunity.
","NA"
"I didn't give Daniel many opportunities to leverage others' strengths to achieve a vision.","NA"
"Daniel can sometimes allow emotions to supersede his decision-making skills when tensions increases in a situation.
","NA"
"Maggie seemed content to do only what was necessary - even when asked to do more.","NA"
"I do not believe Erika is always able to identify others strengths.","NA"
"I do not find any of these to be a particular area of weakness; but select leadership only because it is not an area where I've had the opportunity to position Wajdi in a team allowing him to take on such roles.
","NA"
"Ally could build upon her communication skills and translate this into furthering her leadership skills to capitalize upon the strengths of each of her mentees or fellow mentors.
","IDK"
"I do not see this as a weakness -","NA"
"I would like to see her utilize those strengths in positions of leadership to continue to grow and develop her resume.
","NA"
"I do wish we had more opportunities to evaluate this competency.","NA"
"At the same time, I believe her work style may miss opportunities to share ideas and connect.","NA"
"My encouragement for her would be to identify that goal, and develops tasks towards that goal, but take the time to reflect, research, organize, and modify with the input of others.
","STF"
"This takes a certain amount of experience and time to develop to a high degree, as working with various personalities can be challenging.","NA"
"When given the opportunity, I am certain that he will develop these skills and prove to be a very competent leader.
","NA"
"I don't think I gave him a real opportunity to show his leadership skills.
","NA"
"I don't really feel like there is an area where she could improve.","NA"
"This will simply come with experience as she grows in her career.
","NA"
"I feel leadership is the greatest are for improvement for Krystin because she is willing to take on any task given to her, but does not take the lead herself.","NA"
"I feel that Andrew will be a strong future leader.","NA"
"That is why he now need a strong mentor to help him in this future role.","NA"
"Yet, I feel with proper training and mentorship, he will become a very strong leader
","NA"
"I feel that leadership comes with experience and while he shows the qualities to be a leader, this will come with time and opportunities.
","NA"
"She most definitely has all the qualities of a great leader.","NA"
"She has fantastic ideas related to program development and improvement.","IDK"
"I feel that Mikaela is a leader, but true leadership takes a while to master so she could continue to work on this area.
","NA"
"If she could organize a better team work, I guess, it would not only be helpful for her, but the study would be done in a more efficient way.
","NA"
"I guess leadership comes with experience and knowledge of the job and tasks to complete.","NA"
"I have ask James to faciliate one of our weekly meeting and he does with ease.","IDK"
"Alos with his mentee's he displays great leadership skill.
","NA"
"I am unable to truthfully access this question and will work to make sure she gets some leadership opportunities in the future.
","NA"
"I have seen John display leadership with our summer bridge program.","NA"
"I have seen Kylie grow in speaking up and sharing her perspective in a group.","STF"
"I think she has gained confidence.","NA"
"I honestly have not had many opportunities to witness Maddie's ability to articulate a vision for an assignment or assess the skills of others to achieve that vision.","NA"
"Usually, she is implementing the vision that the director of the Faculty Senate and I determine, but hopefully as she gets more comfortable with our office operations and her fellow intern peers in the spring I can scaffold some experiences to allow her to grow in this area.
","STC"
"He honestly utilized other interns strengths.","STC"
"But if I had to choose one for an area of improvement it would be leadership because we can always continue to grow.
","NA"
"I often feel this is the area for improvement.","NA"
"In all of my employees and myself.","NA"
"Brooklyn is great at organization and development.","NA"
"She is great at design and implementation.","NA"
"For that reason and the fact she has had to work alone in the past to accomplish tasks, I feel she just doesn't have the experience in delegating and leading a team.","TC"
"Although Kasey wasn't put in a position to lead, her passive and quiet at times persona could be a risk.
","NA"
"He's only been here 3 months, but appears to be someone who could be an excellent leader among the other students.","NA"
"Develop that skill and help to bring others along.","NA"
"Document work done, things tried, what failed, what worked, what the results were.","NA"
"1) Seek out projects on his own2) Communicate better when calling out3)","NA"
"I only pick this because we do not put her in charge of others (in our current setup, we really can't) so I don't think our internship has allowed her to improve in this way.
","NA"
"I picked this one, because I had to pick one in order to submit the form.","NA"
"Wajdi has not had an opportunity to execute leadership very much yet.","NA"
"He has done an excellent job with helping a student.","NA"
"I am sure that Wajdi will be a great asset to my group and a great leader.
","NA"
"I rank Kshitij as having the greatest area of improvement in the Leadership category simply due to time in his position.","NA"
"Kshitij simply hasn't had enough time in his position to establish himself as a leader.","NA"
"I genuinely have no doubts that Kshitij will develop into a fantastic lead engineer in his career.
","NA"
"I really don't have much to complain about with Emilie.","NA"
"This internship she undertook did not really give her the opportunity to demonstrate her leadership capabilities.","NA"
"This is not so much of an 'area for improvement', but I hope she is able to gain experience in this area nonetheless.
","NA"
"I really want to see Ely's leadership experience grow and her confidence to lead our intern team.","NA"
"I'm waiting for her to be more vocal in our team meetings.
","NA"
"I selected Leadership because being a great leader defines Meghan Williams and if you are a great leader you possess the other skills mentioned.","NA"
"It is a joy to have Meghan as an intern and watch as she grows and hones her talents and skills.","NA"
"She works well both independently and in a team setting.
","NA"
"I would say there's not as much collaboration in my work site as there is at others, which leaves fewer opportunities for any of the interns to assume a traditional leadership role.","NA"
"However, because of what I've seen Alice do in terms of leading a project (even if she's the only one working on it), I think she shows a lot of promise and I would be interested to learn more about her leadership style in a group.
","NA"
"Although not an issue, more workplace experience would help with this.
","NA"
"but we just didn't get the chance to put him in a leadership role this semester.
","NA"
"I think that this will come as he gains additional experience and continues to develop comfort as part of the team.
","NA"
"This is an area that I would love for there to be more areas for her to grow through this internship and an area that we can improve on for next year.
","NA"
"She took on leadership roles for her mentees as well as prospective Clemson students, but it is difficult to develop these skills quickly.
","NA"
"I think just leadership in general.","NA"
"I think her leadership skills will continue to expand as she gains more work experience and knowledge in whatever field she chooses.
","NA"
"I think leadership is Andy's area for greatest improvement because I believe he has the skills to be a leader, but maybe doesn't seek those leadership positions.
","NA"
"While I have tasks for her to do when she comes in, Natalie doesn't take the lead on assignments or initiate new projects.
","NA"
"I think leadership is something that everyone can always work on, I think this is something I see Abby improving in as she takes on more and more responsibilities within the position and now that she will grow in this and become exemplary at this skill.","NA"
"This is something we will be working on next semester.
","NA"
"I think Liz has a lot of leadership potential and is already a leader in many regards, but based on the potential that she has could improve with more experience.
","NA"
"I think Nick can work more on maximizing the strengths of his peers when he is working with them.","IDK"
"I think Pranav would be a great leader in the Makerspace and something that is achievable for him
","NA"
"I think that Emily has grown a lot during her internship this summer, but I still think that leadership is her biggest area for continued improvement.","NA"
"I have really appreciated her input and observations on how to continue to improve our programs.","NA"
"I do think that she has room to improve with trusting herself and her decisions in this area for leadership.
","NA"
"I think it was difficult for him given that he was at intern level in a large international bank but it is an area that he could improve on in the coming years.
","NA"
"I think that Maddie has great potential for leadership.","NA"
"She should continue to work and improve on her leadership qualities by taking the lead on additional projects.","NA"
"She has great ideas and is very capable of performing well.","NA"
"I think the greatest way that Claudia could continue to improve would be through her leadership skills.","NA"
"She has improved as a leader in facilitating sessions and making decisions about scheduling participants.","STC"
"I think there are leadership roles that would enable Jenson to hone his skills further.
","NA"
"I'm hoping to give her more of a leadership role in the spring to help lead/train the other interns.
","NA"
"Although the opportunity was not available often during this internship, Nithinkumar could use more growth in running projects.","NA"
"I would have love to see the intern take more leadership role in the office.
","NA"
"I selected Leadership becauseThomas has taken the lead in establishing the VR Immersive Space at the Watt Center.","NA"
"But in doing so he also displayed considerable collaborative and communications skills.
","NA"
"I would like to see Niko step up a little bit more during team meetings to express his needs offer his knowledge to others.
","STF"
"I would like to see Raylan become more vocal at expressing his thoughts and questions when tackling tasks and projects.","NA"
"Yet I feel he has the ability to be vocal and take the lead if he had more confidence or experience.
","IDK"
"I would not expect any student undertaking an intern programme to have developed significant leadership skills at her relatively young age.","NA"
"I would not say that Derek struggles with leadership, but just has limited exposure to leading in an industrial environment.","NA"
"I think that Derek can pick this up quickly as he seems like a natural leader, but just needs more time to adjust to newer environments.
","NA"
"Her work is outstanding and she will make a great leader.
","NA"
"I wouldn't necessarily say she needs major improvement in this area.","NA"
"Im not sure Tykia has had a lot of opportunities to build her leadership skills, and she didnt really have a chance her first semester with us.","NA"
"However I see that as she wants to pursue an engineering career, she will benefit from some practice in leadership.","NA"
"Shes clearly bright and willing to take on these roles.
","NA"
"Although the opportunity was not available often during this internship, Raj could use more growth in running projects.","NA"
"I have this planned for him before the internship ends.
","NA"
"Ive seen how Jenna interacts with other members on our team and the way she is a dedicated team leader.","NA"
"She is attentive to detail and keeps me informed of everything going on with the rest of our team when I am taking care of other projects.","NA"
"It is one thing to work well with others, but another to achieve a goal while strengthening a team and leveraging the various skill sets at your disposal.
","TF"
"While I am certain we all have considerable room for improvement in many areas, I'm honestly unable to presently identify which of these would be the greatest opportunity for advance in his case.","NA"
"I'm not sure if this is necessarily an area of improvement","NA"
"but I haven't had the chance to evaluate this competency through this role.
","NA"
"and it's pretty much the only category that would fit.
","NA"
"I'm unable to assess his leadership skills since he works on an individual project.","NA"
"In his position on the jobsite, Tyler hasn't been given a great deal of opportunity for leadership.","NA"
"I think given an enhanced opportunity to lead a group, Tyler will do very good.
","NA"
"I think this can be an area that he could work on.
","NA"
"In the beginning of his internship Max felt it was difficult to impose his leadership to others, but with the guiding of us, we have seen an impressive improvement in this area.","IDK"
"In this UPIC role, there hasn't been too much opportunity for leveraging others' strengths to achieve a vision; which I would consider organization/personnel management leadership.","NA"
"However, I do believe she demonstrates leadership skills in terms of project management.
","NA"
"Interaction and open communication is the key to success and flawless execution of tasks.","NA"
"While Unnati showed already a great way of doing so I would like to encourage her to further improve it his area since I believe it to be the key factor for success.
","NA"
"Hesitant to put herself in a leadership type role.
","NA"
"Intern has strong leaderships skills that, through further development, will help position for future jobs
","NA"
"Once intern develops confidence in an area his leadership skills may very well kick in.
","NA"
"Intern really didn't show any weaknesses.","NA"
"Intern showed progressive leadership skills among peers in projects or personal endeavors
","NA"
"His natural personality is more quiet/timid and if he strives to be a leader in Gray Court it is important for him to learn to speak clearly and affectively with colleagues.
","NA"
"However, it takes a leader to maintain the confidence to teach effectively.
","NA"
"Melissa had challenges with a group member who would miss deadlines or not respond to communication.","NA"
"She ended up taking on the work herself instead of dealing with the situation.
","NA"
"It's difficult to identify an area that needs improvement.","NA"
"She did so well in every aspect of her position.","NA"
"it's my perception that he just hasn't yet had opportunities necessary to learn and grow in this area.","NA"
"strengthening upward/outward influencing skills will help with his research as he seeks inputs from all levels of our company.
","NA"
"Izzy worked extremely hard in the Makerspace and provided great leadership to the students.","NA"
"This semester the Makerspace provided support to over 300 students from all majors.","NA"
"I believe she is ready for this role in the coming semester.
","NA"
"Jack excels already in most other areas.","NA"
"Jackson was able to lead a team of a dozen student hourly workers to maintain a safe and accessible environment for students of all backgrounds to learn machine tool practices
","IDK"
"Jacob has done an excellent job with helping to lead a cross department internship project with multiple interns in multiple different disciplines.","NA"
"All of this is going to be group presented to the mentors/supervisors on a subject matter that is really needed.
","NA"
"I think if she were more extroverted and spoke up more, she would excel in leadership.","NA"
