"Labeled Data","Final Label"
"Her work is excellent, but stepping back from it to see how each of these features or stories we tell fits into our overall strategy as an office would benefit her.","NA"
"Once again, this is partially our office's fault for not explaining these things and more clearly articulating our vision, but I think someone can easily get burned out in a role if they approach it in a way that is too workmanlike.","NA"
"This is what we would expect.","NA"
"It's difficult to lead while learning a new skill.
","NA"
"This will come in time.
","NA"
"This isn't truly a problem, but I will encourage her to show leadership in making suggestions and volunteering ideas.
","STF"
"This may already be an area that Chris excels at, but it wasn't a skill he leveraged during his internship at NCR.","NA"
"This may be only my perception, since I was not close with Shahab 8hrs a day, but I feel he could learn new things faster or solve problems more efficiently by brainstorming with colleagues and formulating rough ideas to others and receive feedback or alternate approaches.
","STC"
"This past semester John was learning the ropes, but in the future he will be expected to lead new recruits and pass his knowledge and experience to them.
","STF"
"I think though, as she gains more experience, she will be an effective leader, as she is a critical thinker who is able to prioritize her work and meet deadlines.
","STC"
"This semester I gave Jillian several opportunities to lead projects and make them her own, rather than having her do tasks for me related to these projects - she was very successful at this.
","NA"
"At this stage of the internship, Leadership would be a difficult competency to demonstrate but needs to be an area of focus as Alvin progresses in his career.
","NA"
"However, Cole has now been voted the VP for the Makerspace.
","NA"
"This semester, Ashley has really shown growth in the area of Leadership.","NA"
"This should not be seen as a knock on Ally.","NA"
"This position just doesn't lend itself to really leading others.","NA"
"This should not be seen as a knock on Dani's ability, but more a reflection on her experience.","NA"
"As her full-time career grows, I have no doubt that she will become a great leader.","NA"
"This student has been highly proactive in coordinating work with his mentor and other collaborators for carrying out excellent research work.
","NA"
"This student may have great leadership but his position didn't give him a stage to show it.
","NA"
"Furthermore, her leadership skills were not strenuously tested during this internship.","NA"
"One of Sneha's tasks was to work with another undergraduate level intern, and she sufficiently helped and guided him whenever he approached her with specific questions.","STC"
"This will be derived from experience as Lili continues to grow.
","NA"
"Thomas is reserved and can easily get lost in the crowd if he is not held accountable or challenged on a regular basis.","NA"
"Though it is more difficult for the intern to excel at leadership, I would like to see him become more self motivated to take on specific task within the office.
","IDK"
"I believe she has the ability and would encourage her to grow in this further.
","NA"
"Tiffani is a great leader, but as many of my other mentors she could use more practice in her leadership skills.","NA"
"Tiffany is truly autonomous and takes initiative in her work to make it the best!
","NA"
"She took projects such as the Clemson Students account to the next level and she helped our newest intern out tremendously.
","NA"
"If there is anything that Tony can do or improve to make things easier for his coworkers or supervisors, he is more than ready and willing to do so.","NA"
"Lastly, Tony is an excellent leader of groups and volunteers.","NA"
"He is good at keeping a list of tasks in his head that always need to be accomplish and then finds and manages the right people to complete the task.","STF"
"Very consistent in getting tasks done punctually, high quality of work done, and strong desire to to do a good job
","NA"
"His past mentees and present mentees still come to him for help and advice.
","TF"
"Tre is a PEER mentor in his sophmore year of college and doing an amazing job of leading his mentees.
","NA"
"She is able to see what may or may not be working in a situation and creatively think of ways to improve the situation.","NA"
"She can problem solve quickly.
","NA"
"Though she did not have many opportunities to demonstrate her leadership skills, she will in future rotations.
","NA"
"Tyler was ble to get his metors involved in campus activities and other oganizations through his leadership abilities
","NA"
"Qing is a good team player, but he needs to work on timely and complete execution of tasks for his role in the team.","NA"
"I would often find he had work completed but wanted to get something else done too before handing off what he completed to another teammate.","NA"
"But, this is something that is learned over time.","NA"
"Qing and I have spoken about it, and he's working to improve upon this.
","NA"
"Azrin maintained a great relationship with his mentees throughout the entire year.","NA"
"Very good at getting the groups started on projects without being asked.
","NA"
"very knowledgeable and could be a great leader, just needs the opportunity
","NA"
"Always willing to help and learn as much as possible about the job and the expectations.
","IDK"
"Very strong leader of the body-in-white team; excellent technical depth; leads by example and is recognized as an authority by the entire team
","STC"
"Victoria had lead the school book project for three semesters.","NA"
"She was always thoughtful and deliberate about the process.
","NA"
"When leading a group it is helpful to project one's voice and show some confidence.","NA"
"I do think he does have very good leadership skills and would flourish in an environment where he is given more opportunities to lead.
","IDK"
"Bailey brings a level a poise to the work she does that very few othere in her peer group could acheive.","NA"
"She takes charge of situations, she is self-directed and she finds ways to bring great things out of those she works with, even beyond what they thought was possible.
","IDK"
"Wasn't given many opportunities to show this so we hope to do that in the spring!
","NA"
"We welcome Liyang's involvement and critical thinking in our healthcare projects.","NA"
"However, I believe Loyang is used to a more structured environment and is hesitant to put forth ideas on his own thinking out of respect for more senior members of the team.","IDK"
"We were not able to put him in any leadership roles this semester","NA"
"but we expect he would be excellent in this area as well.
","NA"
"Whereas I believe that Aditya can and will make a strong leader one day, unfortunately this position is not well suited to show off leadership skills.","NA"
"At this distribution center, the Inventory Department consists of just one person; the Inventory Manager, so there are no employees to lead.","NA"
"While Hannah excelled in her contributions on our team, the internship role did not lend itself to a strong representation from the above listed LEADERSHIP competency.","NA"
"I can see her career benefitting from a boost in self-confidence in her knowledge and abilities going forward.
","NA"
"I can see her career benefitting from a boost in self-confidence in her own knowledge and abilities going forward.
","NA"
"While she did show leadership skills in her work on several projects, I never really felt like she stepped up as a definitive leader during the course of production on projects.","NA"
"While there have not been that many opportunities for collaboration and working with others, our organization has various departments and experts.","NA"
"I would have liked to have seen Lucinda get to know and utilize those folks more deeply over her time here.","STF"
"While Tyler works well in a team, she can improve in taking the inititiave or a leadership role.","IDK"
"She is becoming more familiar with our programs and events and hopefully will do so next semester.
","NA"
"He could expand this by learning to lead others to do things they are capable of doing, which he has been working on.
","NA"
"Worked solo most of the semester
","NA"
"Bailey worked one part-time internship and her goals were to learn job skills needed to perform her job tasks.","NA"
"In one semester, she was not able to attain the experience needed to develop leadership skills.
","NA"
"IT WOULD HAVE BEEN A BENEFIT","NA"
"BUT, THE SITUATION DIDN'T ALLOW
","NA"
"She is an excellent team player.
","NA"
"Because of not having the engineering background, Hannah was somewhat hesitant to take the lead with our STEM programs.","NA"
"Because she hasn't the opportunity to leader a team
","NA"
"Becca is a great team player, but does not always step up and take the leadership role in areas where we know that she would excel.
","NA"
"But Sarah Grace can be reserved, so it will be interesting to see how this skill develops.
","NA"
"Abby did not have the opportunity to demonstrate her leadership in our work.","NA"
"As an intern, Ben had the opportunity to lead a team in a week long focus on workplace organization and ventilation.","NA"
"Bethany was not able to be in a position of leadership, so it was difficult to evaluate this characteristic.","NA"
"If i have to choose one with slight improvement it would be leadership.","NA"
"Confidence in decision would bring her to a cut above the rest.
","NA"
"Blaine is very proactive and shows great initiative at times.","NA"
"Blaine, has been with me for two years.","NA"
"Her greatest strengths would be all of the above.","NA"
"Blaine has the patience and where with all to assist and pick up in any event/situation.","NA"
"She has been a leader in helping to train the incoming UPIC intern and make sure they have all of the information they need to succeed.
","NA"
"Leveraging these skills and developing leadership will set him on a very successful career path.","NA"
"This is not to say that Bradley has a weakness in this area, but to emphasize his great potential.
","NA"
"Bri is definitely able to identify others strengths and challenges, but she sometimes lacks the confidence to act on her instincts in helping others improve or encouraging them to tap into their strengths for future use.
","TF"
"Brianna is young and does not have a lot of experience.","NA"
"She is confident and articulate and with time and experience, people will follow.
","NA"
"Brittanie has not had multiple opportunities to grow her leadership skills and realizes that she needs to improve these skills.
","NA"
"Leadership is not a skill this internship afforded her an opportunity to practice.
","NA"
"Brooke has a strong personality and will mature into a great leader.","NA"
"Right now she is watching and establishing herself and the future leader she will become.
","NA"
"As she matures in her career, I hope she will be more confident in herself and become a leader in her field!
","NA"
"Caleb has all of the skills to be a great leader but he doubts himself, in addition he needs to understand strategy, empathy for others, and how to use his thoughts to influence others.
","TF"
"Given all of his other positive traits, I have no doubt that he will become a strong leader.
","NA"
"I listed this as an area of improvement as I believe some things he was working on independently he could've asked for help sooner or leveraged others to be more effective.","NA"
"CARMEN IS A NATURAL LEADER","NA"
"BUT SHE DID NOT HAVE THE OPPORTUNITY","NA"
"THIS IS SOMETHING","NA"
"SHE CAN ASPIRE","NA"
"Caroline lead the team that produces the English department newsletter.","NA"
"Her group successfully completed 7 issues of the newsletter which required interviewing, editing, and producing around 30 articles.
","NA"
"I think leadership includes having initiative and that's something Caroline could improve on as well.
","NA"
"Carter lead the UPIC magazine project this year and successfully managed her team.
","NA"
"She also kept her mentees engaged with other activities across campus.
","NA"
"Castles served as my right hand and delegated responsibilities to his peers.","TC"
"Catherine has not had as much opportunity for leading tasks so we plan to work on that next semester.
","NA"
"Catherine is always accepting of projects or tasks when asked, but I think she has room in grow in taking ownership of projects - identifying the next steps herself, noticing problems or issues, improving upon them, and bringing others into the project.
","IDK"
"He could benefit from the opportunity to lead and drive a high impact project.
","NA"
"Chandra's leadership and communication skills have grown during his many months here, but there is still room for improvement.","NA"
"Chanty is a great leader, but could continue to grow in her leadership skills as she finishes her senior year and approaches graduation.","NA"
"Actually, it is very hard for me to say just a one quality - Meredith is an excellent student on all those qualities.
","NA"
"Chase needs to be more empathetic and understanding of his fellow team members and then how he needs to adjust his management style to address concerns.
","TF"
"These are skills that most people develop over years in the workplace, so I would not expect a PhD student to have obtained them yet.
","NA"
"Clary lead in many ways amongst his peers.
","NA"
"other members of the team have been very independent and while Colleen would clearly like a greater level of collaboration she's not been able to find the common ground on which to build that.","STF"
"Leadership is often the most difficult skill for students to learn and I think that with another semester on the team she could make great strides.
","NA"
"Collin is quiet and reserved with staff.","NA"
"We would like to groom him to become more involved with mentoring our underrepresented freshmen students.
","STF"
"He has good leadership qualities and could do well in that capacity, but his performance in this internship showed only his capabilities for following others direction.
","NA"
"Considering that leadership is perceived / exercised differently in an international corporation like Daimler compared to the university level I believe it is common that interns like Jennifer have a hard time to exercise leadership on their own.","NA"
