ID,PID,Text
670,670_0,"""I worked a couple of tabling events in which I answered prospective families' questions about Parking and Transportation Services at Clemson."
1072,1072_2,"and he knows how to designate a job for all of us.
"
776,776_0,Leadership wasn't needed.
1151,1151_0,"""Through this experience, I was able to serve as a leader to these students by connecting them to other organizations which I felt that would get them the best connected to Clemson."
541,541_1,"I also led my student organization on projects and recruitment tasks.
"
996,996_0,"Participated in discussions regarding the marketing strategies that the Bulls Sox Academy could use.
"
652,652_1,I had to test many possibilities and create standard operating protocol documents for this candidate.
945,945_2,"This is because he respects others opinions and values that their ideas may have a fresh and beneficial outlook on the problem at hand.""
"
898,898_1,"We would all offer different ideas from each other.""
"
656,656_2,I then had to combine my findings and pitch to my bosses why we should purchase a golf cart and which option to go with.
307,307_1,He would set a few workers in groups together and would write down the job to be done.
148,148_0,"""Being put in charge of the Clemson Light Imaging Facility gave me a basic understanding of Leadership, this allowed me to understand the requirements and needs to be in charge of a task and a project.""
"
734,734_1,"Now that finals are approaching I created an excel sheet so that they can see what they need to do in order to reach that goal or if the goal can even be met.
"
581,581_0,I saw Dr. Hannon take 15 students from all backgrounds and mold us into a collective unit.
951,951_1,"I always took into account that her views were very different from mine, and rather than view that as a weakness or attempt to change her opinions, I'd try to get her unique opinion to help move the design process forward."
1136,1136_4,"This requires a lot of leadership on my part in order to make sure all of our positions are working together effectively and aware of what the immediate and overarching goals are.
"
1132,1132_1,"This was a great way for me to step into a leadership role.
"
884,884_3,"Tim then took note of this and applied it to other buildings on campus when the same kind of monitor would be installed.""
"
945,945_0,"""One of the main leaders that I work with is named Erich."
288,288_0,"""During the same situation above, I was tasked as the leader for this group and had to make sure my team stayed motivated for the project."
1315,1315_2,"It was then my job to present this final product to all of the stakeholders including both department heads, my advisors, and my team.""
"
327,327_3,"In the end I believe we reached some actionable conclusions and presented them to the rest of the department. ""
"
709,709_1,They were scared the new area would only be attractive to men and no women would use it.
445,445_2,"I noticed another intern, Tom Birdsong, taking responsibility and leadership over the creation and initiation of the CCIT Immersive Space."
26,26_1,She methodically addressed each person on the research team to confirm that he or she was following through on job duties.
19,19_5,I also attended scrap meetings which took place with the COO of the plant.
1065,1065_6,"This was a great example of a supervisor recognizing and utilizing the specific strengths of an individual. ""
"
838,838_5,"Whenever she is creating marketing material, she asks me to look at it and make adjustments to format, colors, fonts, arrangement, text, etc. ""
"
961,961_2,"As leader of this project, I was tasked with the facilitation of the discussions surrounding this project."
1343,1343_2,"Because it is a small business, I felt comfortable enough to address the low morale employees and tell them the only way it'll ever get better is to address the issues."
1083,1083_0,The plant manger at my plant leads a team of supervisor from all departments.
68,68_0,"As an important auxiliary department of the university we made efforts on our social media platforms to promote the messages of other departments and organizations across campus in order to help the in their goals to communicate effectively with the students faculty and staff
"
903,903_2,My supervisor saw skills
737,737_4,"Ultimately, they all finished the maths problems and turned in their assignments."
854,854_2,"The key to this endeavor was keeping in constant communication with each party to ensure that everyone's needs were being met and everyone was on the same page.""
"
494,494_0,"""I have planned many info sessions and class visits, as well as organized all of the students going abroad from the UNiC side, and Clemson's side. ""
"
995,995_7,"Now we have less driver/greeter miscommunication and fewer guests left behind.""
"
483,483_0,I have gained so many great leadership skills through this interview.
303,303_1,A few times it was my idea that was the solution
754,754_2,"I also opened up to my WISE staff about having and eating disorder and how important it is to look out for that within the menses because it is so common among college age girls, especially engineers who are under loads of stress.""
"
1314,1314_1,"Keeping all of the children engaged and contributing to the task at hand was hard but a very rewarding job.
"
953,953_0,"""One of the projects during the semester for Spiro was a video advertising the Spiro Living Learning Community for next year."
995,995_3,"so they would drive right by the load zone, without loading the standing guests."
1231,1231_0,We worked on a big student profiler project where I was able to edit and organize profiles of students who have received scholarships from Clemson donors.
783,783_1,"This has allowed me use leadership skills to foster collaboration and achieve the results we need to accomplish our task. ""
"
224,224_0,"""During my internship, I was able to train the new Student Event Coordinator as this is my last semester working as an SEC."
1114,1114_2,I used my previous knowledge about quality and the concerns they had about these racks to lead the team to do some testing and make suggestions for improvements.
667,667_0,"I work to lead creative inquiry groups and other interested on campus organizations in serving as an extension of the Clemson agricultural extension program and working to connect the community and Clemson students to local food systems.
"
124,124_1,Because of this there are many opportunities to inspire others while also receiving feedback from other viewpoints.
1093,1093_1,Through information and drop-in sessions I helped RiSE students find programs that could work for their majors and advised them on how to go about the study abroad process.
269,269_0,"""During team meetings, I lead discussions regarding communications and ways to make it better."
138,138_0,"""Because of my role as a manager, I set the example for my coworkers and staff members."
803,803_3,"As her assistant, I often filled in fo her when she could not be present, delegating tasks and creating dialogues with individuals from different departments to improve the programs for the future.""
"
39,39_2,"In order to help them progress, I would often help them align their narrow objectives such as writing a literature review to why they are doing it."
1214,1214_2,and we were going over all the ideas and how to improve each other in certain aspects
644,644_0,I was involved in some of the meetings with the senior QEs.
818,818_2,"That response made me a better team member and a better worker in all aspects of my life.
"
585,585_0,I saw my supervisor bring out the best in all team members.
888,888_3,"Certain members were stuck on points of the project but having multiple perspectives was useful in allowing us to move forward.
"
357,357_1,This helped me to understand the problem they face regularly and think about how to overcome them.
464,464_0,"""I had to drive the change to the new database, so I had the responsibility of taking leadership on this and making sure it was going in the correct direction."
962,962_1,At first she was assigned to make models for our projects.
887,887_0,"""My work team holds weekly meetings to handle business of the lab, regular project updates and discuss new discoveries in the field."
941,941_2,"She is very passionate about the programs and relayed that to us and had us become advocates for the programs as well. ""
"
959,959_2,"With every member part of the discussions coming from varying backgrounds, often times discussions would get sidetracked for the entirety of the meeting."
300,300_0,During training we encourage the new hires to ask questions and we open up a space for them to express any concern they have about anything.
549,549_3,I spent a good part of the semester communicating information about Cange and the needs there to these project teams.
387,387_2,"He keeps a calm meeting room to promote solutions within the group.
"
957,957_1,"I believe that I helped facilitate an environment where my coworkers could talk to me and to each other about our applications, which often involved writing detailed essays of deeply personal experiences."
1246,1246_0,"""when discussing new project ideas for the future, the floor is always open for different ideas to accomplish goals."
277,277_1,"They usually meet their goals and if they don't, I work with them on how to achieve them next time. ""
"
1005,1005_0,"""Prior to the Spring Jubilee Festival, we realized that the construction in downtown Pendleton would cause a change in our usual booth locations."
818,818_1,The responsibility I was given strengthened my self-confidence and improved the quality of my output.
43,43_0,"""All the employees are supervisors are leaders every day here when they advise and talk to students."
888,888_1,At one point during the project we set up a meeting with between ourselves and our boss and supervisor.
1216,1216_0,"""We have one employee, Richard, who is highly efficient with the Hardinge CNC lathe."
986,986_1,It was my responsibility to take care of the cage and report to the supervisor (Director of Engineer) if its not in good shape.
850,850_0,"My mentor was the boss for the team so I got to watch him organize the team and act as a leader.
"
304,304_0,"During WOW Jr. I had to encourage the students to form answers on the topics we discussed to ensure they were actively learning.
"
615,615_6,"Instead of canceling I decided to still do the interview myself so it would still get done on time. ""
"
1285,1285_0,When the Senior Scholars came to the lab I took the leadership role and tried to guide them on the best ways to do things rather than simply just telling them how it is.
617,617_1,"Even when times looked rough, I told them that they are more than capable to complete tasks and projects.""
"
1096,1096_3,"I had to actively discuss with the workers what they ""
"
808,808_0,My boss is a good leader and understands peoples backgrounds and how they work.
158,158_3,I have learned that these clinicians must remain calm and level headed and must be sensitive to the diverse backgrounds and needs of all clients.
849,849_0,"""My mentor was a great leader and got different people together all the time."
1254,1254_1,The discussion was open and it got to a point when I disagreed with my supervisor about which intern we should higher.
222,222_0,"""During my internship, I took lead of the Control Documentation team for new programs and co-operatively led the cross functional team in an effectively managing their individual schedule to meet my target deadline hassle free""
"
1178,1178_0,"Understood basic ideas about what all engineers do and then started attending meeting with all of them and learning/analyzing what is going on.
"
227,227_2,One such occasion was a meeting with housing on getting students checked into housing after hours.
981,981_2,"She always found ways to relate to both of our career interests.
"
404,404_1,Everyone worked together to improve the service desk at Cooper Library and kept everyone updated on ideas and gave feedback.
145,145_1,"There were many instances where I would be overwhelmed with large projects, but would effectively communicate the plan and vision with others so that they could create the graphics I needed.""
"
988,988_1,People didnÕt take backing were seriously.
526,526_2,"Additionally, I participated in collaborative conversations between Georgia Tech and Clemson.""
"
936,936_1,"She met with maintenance and catering so they were all on the same page with set up of the tables and food. ""
"
762,762_0,Krysten worked tirelessly to put on the first coffee house and shuttled all around Clemson and Anderson to get catering and make sure everything was right.
1071,1071_0,"""The internship at the dairy is not really a group activity, its generally only two individuals running the parlor: one intern, one farm employee."
225,225_0,"""During my internship, I was always eager to get those around me engaged in conversation."
456,456_3,"Now my program is being used by other groups as well.
"
414,414_1,"So that we could have healthy two-way communication.
"
164,164_0,"""Communicated outcomes from TOD meetings with correct stakeholders, to make sure everything goes smoothly.""
"
284,284_1,"In the meeting, the department supervisor would first summarize the accomplishments of the department during the previous month."
665,665_2,She respects her team by always making any work that is not directly in their job description an optional activity that they can decide to participate in if they want.
259,259_2,"During one of the first meetings after this new process that my boss couldnt make I had to step in and explain this new process to the assembly line section leaders.
"
986,986_3,I brought this to my Supervisor's attention.
188,188_1,He had brought in people from various backgrounds for the brainstorming session.
64,64_0,As a part of the 'burst builds' and 'run at rates' the monitors would meet to document open issues and assign responsibility to different individuals/departments.
67,67_1,The ending project for the CI was to produce a project proposal and present your research to the staff.
118,118_0,"""at mentor group meetings, I ask for the opinion of others. ""
"
1179,1179_2,"Likewise, during the fall, our entire group worked as a team to effectively carry out this competition."
424,424_1,"That sheet was aacesible to all the employees on the job site and helped all the employees to spend accordingly.
"
573,573_3,It was expertly managed by the project leader and executed by everyone.
917,917_1,I am not the only intern within my department and there are about four others who work under my mentor.
309,309_0,"Each semester we are required to lead our team meeting in discussion where we assign articles to read and give a presentation to the group.
"
666,666_1,"However I see independent working as another form of leadership.
"
710,710_1,"It varies from chemical engineering, to electrical engineering, to civil engineering, to others."
226,226_3,"Instead of the managerial staff leading the meeting, the foreman on each shift were asked to lead this particular meeting because they were the """"on the floor"""" experts who used it every day."
137,137_0,"""Based on my research objective I formulated a set of methodologies and shared them with my mentor and fellow interns."
1037,1037_1,"My supervisor put together a team to analyze the parts, to determine the reason for failure in the parts."
330,330_4,"It really helped us develop our communication between workers.""
"
73,73_3,C3 had these lunches called intern lunches and at each lunch somebody very important and high up in the company would talk to all the interns.
395,395_0,"I am the oldest of the interns and they all look to me to guide them when starting task and ask me to evaluate them upon completion.
"
579,579_0,I recall assisting a group of clients who didn't know what direction they wanted to take an assigned project.
455,455_0,"""I had a problem mid-way through the semester with my higher up's not being responsible and allowing the lower ranking workers to get away with things that should not have been allowed."
987,987_0,Our supervisor Robbie is always super encouraging to everyone around us.
974,974_0,"Our event took place right after the big hurricane hit in the month of October and I encouraged discussion about if the event should be postponed or if other means of communication was necessary in order to get all information necessary for the event to take place.
"
1329,1329_0,"""While working with the Social Media team, I attended weekly meetings to outline goals and content that we would be creating and uploading during the week."
721,721_0,"""In order to empower others, I allowed trainees to do protocols first alongside me, and then encouraged them to do the protocols themselves once they felt comfortable on their own."
83,83_0,"""As I mentioned in the collaboration section, there was another intern with whom I worked closely."
321,321_0,"""Every day our mentor would give us our tasks for the day, and she would base those tasks off of what was everyone's strengths. ""
"
1087,1087_1,I took the responsibility of the code that I had written and also analyzed to see that my fellow teammate whose code did not had problem.
191,191_0,"""During academic recovery workshops, I led students in small groups that focused on them reaching the shared goal and vision of transferring to Clemson and what ways they could reach that goal."
49,49_1,"Therefore, there has been many instances where I have been look upon for guidance on what to do.""
"
1232,1232_1,"It was interesting to be able to listen to the entrepreneur when they gave advice and sort of walked all of the interns through how they started their own businesses.
"
61,61_3,"For older cast members, this was a different method than they were previously using."
498,498_0,"""I have to become a leader when helping other students with the testing in Adopt-a-Stream, making sure they conduct the testing properly and guiding them along the way. ""
"
603,603_0,"""I think our office is unique in that we are assigned specific jobs but each person usually ends up working on everything that goes through the office in one way or another."
657,657_0,I was the first intern to join in this project.
133,133_1,"While my coworker was feeling discouraged because it was so close to final exams, but I came up with the idea to split up the assignment evenly so that neither of us felt overwhelmed."
142,142_1,"Everyone was able to ask relevant questions and express concerns before we came to a group decision on how to set up the plots.
"
209,209_2,"Allowing the connection of these two organizations to come together to work on having a hiking trip held for the LLC.
"
130,130_1,"we worked to develop an idea that everyone liked and everyone had a role in making it come to life. ""
"
420,420_1,I worked around each person's schedule and tried to place them at their desired role.
1157,1157_2,"This broad organizational objective was necessary in creating consistent, accurate Campus Recreation branding. ""
"
450,450_0,"I gave solutions to solve the problems of the line and robots.
"
715,715_1,"For example, the Watt Center emphasizes cleanliness throughout its building as a part of its brand, so I ensured that promotional materials within the Immersive Space fell within these guidelines (were either explicitly Watt-sanctioned or adhered to the spirit of the Watt brand)."
11,11_4,Everyone helped each other and used their strengths to assist the others.
344,344_0,"""For a project that had some problems, we had some people who worked at Prettl Germany who specialized in PCBs and Electric components to help guide us and share their knowledge and expertise with us."
726,726_2,"It was also important for me to say the importance of the work we have done, because we have touched raw data that can help engineering students in SC."
507,507_0,"""I helped align the objectives of a group of students and their Professor, Dr. Amber Curtis, involved in the """"Assessing the EU's Influence"""" Creative Inquiry project by interviewing the students in the presence of Dr. Curtis, who facilitated their responses within the scope of her own expertise."
1184,1184_0,"""Very similar to what I described above in the first meeting I had with a Risk Area, we met with that same Risk Area, but this time, the major of the Risk Owners were present at the meeting."
378,378_8,This specific producer has used research and scientific evidence to develop his intensive grazing management practices in an effort to cut down on internal parasite populations.
96,96_1,"There were a lot of experts people that encourage me and other interns in our projects to develop new approach based that is much appropriate for our projects.""
"
942,942_1,The idea is that they familiarize themselves with Clemson and network to learn what Clemson is all about.
302,302_2,"This caused use to be able to openly discuss the magazine as a whole, and let the writers have a say in the design, and the designers even have a say in how some of the articles were written."
67,67_4,I had to be the neutral member in this situation in order for the group to make progress and be productive.
1180,1180_1,This is a great way to have informative discussions and really just be able to learn and push everyone else.
561,561_0,I observed my supervisor assign duties to my fellow intern.
943,943_2,"I assisted in determining what the key objective of the program was so that we could determine who the correct points of contacts were within the administration.""
"
119,119_1,I work with another intern.
816,816_1,"She directed all of the interns during various projects in order to improve the efficiency of the probate court. ""
"
482,482_1,"I coordinate all communication between us.
"
1,1_2,The first semester I worked this internship I worked underneath a different clinician.
312,312_1,"When there was a project that was very photo heavy, I took the lead on it and worked with other departments (video, social media, writing) to produce the best possible content for the social media team. ""
"
1157,1157_0,"""Throughout my internship, individuals would come to me with their information and deadlines and I would create marketing activities based on these specific needs."
717,717_1,"There was a heavy emphasis on diversity and inclusion and in finding the right story.""
"
933,933_1,"This mainly meant creating a study abroad program that would appeal to students within the department based on location, classes offered, and the living accommodations."
347,347_0,For most the time I was responsible for closing the WATT center IT department.
603,603_2,"I often find that I spearhead jobs and then delegate to other people throughout the whole thing, making sure that each person's opinions are heard and everyone feels valued and useful.""
"
1142,1142_1,Through SEE Clemson I gave prospective students and their parents tours of campus and sat on a panel for the students to ask questions about Clemson.
380,380_0,I added a section to each week's meetings where interns could discuss any problems or ideas they've had about the space.
404,404_0,I attended 2 meetings a month where I would meet with the whole instruction team about everything that was happening in Cooper Library.
909,909_1,A lot of the projects that we do takes a little bit from each department- the writers create a script
858,858_2,"Under her guidance we were able to most efficiently conquer the task at hand. ""
"
308,308_0,"Each semester our mentor helps us each develop individual learning goals and uses each of these together alongside our individual strengths to make the pressroom operate more smoothly.
"
1160,1160_0,"""Throughout the semester work was being done to the 4th floor."
1233,1233_1,I would listen to their points of view and then together we would look and find programs that fit into their schedule and curriculum
234,234_0,"""During my internship, we have had a few """"team meetings"""" in order to make sure everyone is on the right page."
1203,1203_0,"We had monthly ambassador meetings where a group of us within Campus Recreation would meet and share ideas with one another on how we could better the department and what steps needed to be taken to do so.
"
909,909_3,Other times we work together to create Instagram stories as well.
497,497_0,"""I have the duty of coordinating a videographer, photographer and candidate for each story to schedule a meeting and then lead the meeting. ""
"
1316,1316_0,"""While I am not in charge of a team of people, I do encourage those around me to do their best."
517,517_1,"For the student who we awarded this to, I was responsible for putting together a prize basket to recognize the intern's accomplishment."
637,637_3,"It was very effective and effeicent and it allowed to be a leader and learn how to delegate.""
"
1221,1221_1,This was one of our main goals as we wanted our members to be able to reach us through multiple platforms.
1287,1287_3,"I also assisted in breaking up the classification of prior and current transactions to fit with our new classification. ""
"
455,455_2,"I had to spend a lot of time checking back over their work to make sure that everything was on track, but so far the work has been exceptional! ""
"
981,981_1,This was helpful in counseling for phone calls.
218,218_0,"""During my internship, I created an initiative to create a project on campus."
1054,1054_6,"This semester I didn't have very many group meetings, most were one-on-one or me acting as a liaison between two different parties.""
"
367,367_1,"It was important to be knowledgeable about the machines in order to teach the, ""
"
