ID,PID,Text
691,691_0,"""In a leadership position for the Pearce Digital Marketing team, I helped brainstorm with and lead my peer Carter Smith to her writing subject for her blog post this semester."
1044,1044_0,"""Taking in OLLI members opinion on new classes, the employees were always very willing to listen ""
"
837,837_3,"The mentor need to guide the clients on what we can or cannot do while trying to follow their requirements the best he can.
"
1050,1050_2,I used this knowledge to help new interns learn some of the day-to-day tasks that are performed.
642,642_5,PEOPLE SAY
757,757_4,"By working together, we could come to better conclusions than just having Jackie tell us what she thought about those issues."
1174,1174_0,"""Tullen has been an interesting supervisor to work with, as he does a lot with Creative Inquiry."
757,757_1,"In these meetings, Jackie would praise us for what we did well and give us ways we could improve."
888,888_0,Myself and my fellow intern were put in charge of a project of lowering manure moisture.
1108,1108_0,"""There was one time where each of us interns were discussing what our current projects were, and what we were doing to achieve them."
588,588_4,"Initially, the role playing was not as professional as I wanted it to be so I was able to discuss what I imagined the role playing situation would be like with the committee member."
1210,1210_1,"Since all of our projects differ a lot in fields, they are all science related."
937,937_0,"""One of the accomplishment of the Spirit Task Force this semester was the termination of the balloon release at football games."
904,904_3,"With the new information, we discussed how to best divide up the volunteers, who was to lead each smaller group, and what they would be doing."
1210,1210_0,"""We have a total of ten interns/grad students, plus a large faculty at Baruch everyone has been given the chance to become their own leader."
638,638_1,"This meant that for each lesson of the grant I wrote all the information for the lesson. ""
"
446,446_2,"Nonetheless, I did display SOME advanced leadership skills that I learned from studying."
72,72_2,This manual would have everything from the confidentiality pledge to instructions how to communicate with donors and everything in between.
535,535_0,I learned to trust others in the process of putting on a show.
158,158_2,These clinicians show tremendous leadership by leading a diverse group of students while they navigate issues that are often difficult to talk about.
227,227_1,During those meetings my mentor always asked for input from everyone at the table on how to solve problems related to the exchange students.
170,170_1,"I also encouraged them to pursue projects their talents were suited for. ""
"
201,201_0,"""During multiple times during the semester, I've seen Mrs. Lisa organize events for the PEER/WISE program in which minority students of all ages visited Clemson."
1286,1286_0,When the supervisor realized the individual strength of the interns and assigned them tasks best suited to their abilities.
700,700_0,"""In certain situations, we encouraged one another to spitball ideas as to how to solve IT problems""
"
1159,1159_1,"This was very interesting and was something that helped me understand what success really was in the business world through many different lenses and industries.
"
934,934_0,One of my supervisors utilized another intern for a specific project that involved him to write a script using Python.
298,298_0,"""During the weekends, it is very easy for the counselors to get tired and want to just watch campers do the activities."
368,368_1,"will also additionally take more responsibilities.
"
1068,1068_2,"By recognizing this opportunity and clearly communicating its value, I was able to convince my mentor that this was a valuable use of my time as a UPIC."
199,199_1,"When we work together, we would plan out what we are to shoot and share with one another what we want to see in the final videos."
366,366_0,"""Given the nature of my internship being team-based this semester, myself and my partner had a common goal of success."
937,937_3,"In the club meeting, we had a constructive dialogue about how to replace the balloons with something equally as exciting that preserves the tradition as well as the environment. ""
"
1008,1008_0,"""Recently, project management has rolled out a new strategy that includes having teams document their projects in a more rigorous way."
900,900_1,"Also, my mentor appreciated those plans. ""
"
134,134_0,"""At the farm, this is a heavy requirement."
1217,1217_3,"She capitalized on everyone's strengths such as her relationship with the Dean, Rachel's ability to schedule and her relationship with the people at the venue, Doug's relationship with donors and """"people person"""" abilities, and the event was rescheduled with an invitation sent out the very next day.""
"
639,639_0,"I was in charge of the hackathon
"
804,804_0,"My adviser was debugging a fault and immediately assigned emergency responsibilities to analyze various parameters responsible for the fault
"
328,328_1,"It was great to be able to share what I've been working on and receive feedback from the others about what needed to be fixed or improved upon.
"
549,549_0,"""I managed three different project teams for Clemson Engineers for Developing Countries."
1022,1022_1,"This skills defiantly came in handy when I had to train the new summer workers on how things are done on the farm, how to complete a certain task and how to work the equipment on the farm. ""
"
522,522_0,"I helped the student org complete several events they wanted to do.
"
235,235_1,We would each share our idea and then brainstorm off of them.
409,409_2,"This enabled me to empower others to achieve my vision by developing and implementing the project.""
"
1244,1244_1,I was responsible for translating surveys into Spanish in order to better communicate with parents of the hispanic/latino community.
1131,1131_0,This semester I was appointed head intern for my event
268,268_2,"I was able to show that with perseverance, determination, and ambition would can reach your goals and pursue the career of your dreams."
655,655_2,"This allowed for us to come together and have a chance to share and listen to each others ideas and visions an use it to help better our work in our department.
"
982,982_0,"""Our mentor had given us a series of tasks to complete, and after initial communication, we went off to complete these tasks."
475,475_0,"""I have been given the lead role on several projects, but I believe this is a skill that you are continually developing. ""
"
968,968_3,"The teams were often very appreciative of my willingness to work with them and contributed more than they would have if I had not respected their thoughts. ""
"
1167,1167_0,"""To help me further understand why we were performing a test and what the data represents, my supervisor had the grad students who were studying in that area explain to me the reasoning."
788,788_1,"To finish projects as efficiently as possible, projects are divided among the team based on their strengths."
923,923_0,"""One of my biggest responsibilities at the beginning of the semester was to assign all students into project groups and assign project managers to each group."
668,668_1,"For example, I know a lot of the inner workings of how threats spread and can be detected in the network, while my co-intern is good at detecting and taking action for host based infections."
747,747_0,"""Inspired by some of the tools that we found at AMECO, we acquired a large 50 mm combination wrench that we determined would be a neat way to award the project group that we deemed to be the hardest working group among all of the groups in CEDC."
1233,1233_0,"""When advising engineering students, many think that engineers cannot study abroad because of the difficult course load."
114,114_0,"""At Clemson, I worked on a persona project with my supervisor to create personas and examples of students that might apply to Clemson."
447,447_0,"I feel that my leadership level has grown since I have worked here
"
743,743_3,"Though I was not strictly in charge of the meeting, I knew the successful sharing of all the available ideas would be greatly beneficial to a success event and made sure to lead the discussion towards this beneficial sharing. ""
"
473,473_2,I was able to align the importance of the party with the importance of celebrating the employees.
436,436_0,I encouraged discussion between interns and directors regarding a trip to see manta rays.
1287,1287_0,"""When we decided to reclassify some of our accounts, I became the one to notify others in our department that would be affected by this change and make it easier on them."
1265,1265_1,"As I was the older intern who had worked with the team before at the beginning of the semester, the role of directing the interns on where to go in this project fell to me after the senior employees gave us the project requirements."
296,296_0,"""During the UPIC Magazine Project, I helped put together the idea of having specific jobs for each person on the project, like me being the head reporter position. ""
"
1180,1180_0,"""Upon midterm presentations, all of the interns talk together and provide feedback/ask questions to figure out what everyone else is working on."
1022,1022_0,"""Since I have worked on this farm a long time and have had the experience already I feel I have expert leadership skills."
278,278_0,"""During the headshot shoot I gave each person their photo back after editing to double check that they were happy with the photo."
1020,1020_0,"""Since I am the only one working on my project (besides my mentor, who is assisting me), my capabilities (and limitations) are what ultimately influence the future direction of the project.""
"
985,985_0,Our office has weekly meeting to review the week's achievements and set goals for the following week.
786,786_0,"""Many of the conversations I had with the professors and students in the Creative Inquiry program that I was interviewing for each Decipher article, I had to discuss some interesting topics like why these students and that professor decided to get into the research they did."
737,737_2,She gave them the directions and assisted them when necessary.
1284,1284_1,Co-Chair
1322,1322_2,"I really tried to encourage Miranda and Ely to get all their ideas out there and then was able to help combine bits of each of our ideas into one.""
"
119,119_2,We would collaborate a lot of different projects.
570,570_0,"""I organized meetings with the other global departments to discuss ways and strategies to achieve the common goal, improve recruitment for going abroad.""
"
1013,1013_0,"Served as a lead analyst.
"
462,462_0,"I had to be a very inspiring leader this semester to drive my mentees to better.
"
1019,1019_1,I started by making sure each of them had the same level of responsibility as I did and that we all had equal communication with our client.
1207,1207_0,"""We had social media meetings every Monday morning at 10 am throughout the semester."
362,362_0,"""From our daily meetings I observed Bill (my onsite supervisor)."
208,208_0,During my internship I saw my mentor ask another CCGT intern to review and test my workflows and documentation of those workflows.
1311,1311_0,"While designing the UPIC Magazine I had to meet with a group every week and present the design and ask for suggestions and ideas on how to improve it.
"
1051,1051_1,The shared vision was to promote studying abroad this summer by passing out snack with slogans to the student body.
997,997_2,"My supervisors oversees a group of PEER mentors in which they do everything in their power to help them achieve their goals and to also retain them at Clemson, all while promoting events and group opportunities to surround themselves around others trying to achieve their ultimate goal in becoming engineers. ""
"
1218,1218_0,We have to figure out how to do the next step.
79,79_1,I have observed and learned from my mentor Mark's leadership skills.
683,683_0,"""I'm the maintenance lead and my role is to make sure all the machines are functioning properly."
19,19_4,It was a good experience for me.
226,226_0,"""During my internship, I was asked to attend a monthly safety meeting that involved all engineering managers and engineering foreman at the four textiles facilities."
158,158_0,"""CAPS does a lot of group therapy which focuses on clients recognizing and using their strengths in order to alleviate symptoms of things like anxiety and depression."
505,505_0,"I help lead programs on a regular basis
"
95,95_0,As part of my internship I worked to get Collegiate 4-H reactivated here at Clemson.
255,255_0,"""During our intern meeting, I'd present new ideas in how to collect our data and then open it to our mentor and co-intern to discuss the pro's and con's of each option to help figure out if it was a viable option for our department. ""
"
12,12_3,"From their journal reflections, I felt that I watched the girls grow more confident in themselves."
352,352_3,"Additionally, having all of the data in one place allows the entire business to be aligned instead of everyone pulling different reports.""
"
284,284_0,"""During the internship, we had monthly department meeting chaired by our department manager."
1235,1235_0,"""When asking for feedback on Park-N-Ride, I created multiple surveys (both online and in-person) to distribute regarding people's satisfaction with the program."
1244,1244_2,"Then, I had the responsibility of approaching parents at various school functions and conducting interviews in Spanish. ""
"
463,463_0,I had to create storyboards for videos and Instagram stories for the videographer.
998,998_0,"""Per the request of one of our board members, I was given the task to investigate and ultimately create a member directory."
1048,1048_1,"I am simply an average employee. ""
"
186,186_0,"""During a monthly University Development Team meeting, I was able to sit in and observe how it normally operates."
269,269_1,"I have always been a natural born leader. ""
"
67,67_5,"I would often suggest ideas that would be a compromise for both of their ideas.
"
618,618_1,My team captain had very good leadership skills who believed in the concept of 'lead by example'.
117,117_0,"""At ITC, we recently had a very large power outage in the midst of other projects while much of the management was at a conference in Texas."
825,825_1,I have become more confident with corrective action.
300,300_1,"We tell them that we value all they have to say
"
571,571_0,"I participated in PEER Snapshot by co-leading a tour through ClemsonÕs materials science department.
"
87,87_1,I had different meetings that I was a part of and also when just talking to the group themselves I had to take leadership because I had the expertise and knowledge of what truly will work in Haiti and what would be better conceptually.
454,454_0,"""I grew to be an expert in leadership this semester through continuous examination of my all of my mentors, including Tim Howard, Dr. Todd, and even Owen Phillips."
654,654_0,"""I was solely in charge of my project which really enhanced my leadership abilities."
1135,1135_0,"""This semester was a lot of personally led projects."
231,231_2,"For example, a group in our department were discussing a more improved way of pulling W-2s for tax season."
1216,1216_2,"Therefore, as a leadership team, we encouraged Richard to write a training manual for the CNC lathe so that other people would be able to continue its use after he graduates this semester.""
"
256,256_1,I always tried to encourage discussion with the audience during the presentations as well
788,788_0,"""Many of the people of the lab have specialized skills, be it Unity, design, or circuit design."
176,176_0,"Dr. Beecher leading workshops
"
614,614_0,"I tried implementing the different form of concreting which can help the team to prevent the level differences on the job site.
"
714,714_0,"""In my project, I have three people including me in the team."
1277,1277_0,"""When our part lab was getting too full and the numbers were slipping, my mentor organized the members from each zone, set and target date and cleared out the lab to help improve our numbers. ""
"
89,89_0,"""As mentioned before, writers, photographers, and copy editors worked together alongside me in order to reach the common goal of a finished UPIC magazine. ""
"
75,75_5,"The company is still working through the changes but the way he lead and viewed everyone on the team is what created so much success. ""
"
1176,1176_1,"and then I tried to make a compromise from those two opinions to make everyone happy""
"
325,325_0,"""Every Monday morning, the PEER&WISE coordinators have a group meeting in sharing details about passed events, future events, and things need to help the program prosper. ""
"
1271,1271_0,"""When looking at the Watt Center's Instagram account, I noticed some gaps in it."
1213,1213_0,We have meetings every week to discuss important things going on in and out of the makerspace.
101,101_0,"""As stated in the collaboration section, I feel as though I stepped up this semester and encouraged collaboration and participation from everyone""
"
218,218_1,This entailed reaching out to different campus partners and conducting meetings with them.
805,805_0,My advisor combined me with another student in our office to create drop-in hours and other information sessions for students.
735,735_3,"In addition to this, I offered to buy hardware for common use in order to test ideas that dealt with the progress of the project.""
"
124,124_4,"This was extremely helpful in allowing me to get closer to achieving my goal of finishing the app.""
"
366,366_1,"I already knew the expectations, processes and overall vision that was assigned to us, but my partner didn't."
1256,1256_0,"""When I first began writing my article for the Experience magazine, I was surprised to find how many opinions and suggestions go into one piece."
1056,1056_3,"There were a lot of moving parts for me to align in setting up the meeting and we left the structure of the meeting open to encourage brainstorming and idea generation and thinking within a very specific mindset.
"
315,315_0,"""Earlier, in the semester, a guest speaker came to Clemson and two of my fellow interns and I had to produce two highlight videos about it for the Clemson social media channels."
1318,1318_1,"One being me, another being another intern, and the third being the writing center's intern."
1126,1126_3,I would give her an event and run through it with her
484,484_1,"Collectively, we banded together to make it happen even though it required two 11 hour workdays.""
"
958,958_1,"I initiated and led this project by conducting the student and faculty spotlight interviews and promoting those blog articles on the Instagram accounts, so that there would be more pictures of students on the account, rather than just flyers for events."
1254,1254_0,When hiring a new intern I had to sit through several interviews and give my honest opinion on the possible interns.
862,862_2,"The synergy made our work efficiency better.
"
323,323_1,"Proposing ideas and listening to others suggestions is very important.
"
1283,1283_5,"After much discussion and debate, everyone was able to agree on CEDCÕs role in the community and how it should change."
1099,1099_0,"""There was a day when the company had to achieve the common goal of meeting with all the scheduled clients, but it was too much for a normal work day."
913,913_0,"""Once again, I helped our nurse practitioners become more organized and efficient by successfully creating multiple templates for William Mayo (FNP-C) and Michelle Deem (FNP-C) .""
"
457,457_0,"""I had good communication with the supervisor that I had to report to."
720,720_0,"""In one of our larger group meetings, I watched Peyton(another social intern) lead a meeting by giving numerous of thoughts."
79,79_3,He also presses 3rd party employees to meet deadlines and holds them accountable for not meeting them.
362,362_3,"I didn't have much leadership opportunities, as I was not managing anyone directly. ""
"
76,76_0,"""As being a seasoned intern with the Senate, the new interns often come to me with questions or asking for advice with their tasks. ""
"
132,132_4,"CEDC has worked previously with a church in Columbia which has agreed to sponsor work in the village to whom after the information gathered has been further compiled with potential solutions will be presented. ""
"
127,127_0,"""At the beginning of the project, our site mentor was called away to deal with other important projects he's maintaining across the world."
1249,1249_0,"""When facilitating the in person training, the new employees are asked to express their thoughts and questions."
1010,1010_1,"We have a bi-weekly Scrum meeting wherein each team-member shares openly what projects that have worked on in the preceding two weeks, where they are at with their projects, and what issues are ÒblockingÓ their progress."
119,119_7,"In the end we ended up using the stickers for our tabling event instead of pens. ""
"
977,977_1,I helped in coordinating and setting up the event.
472,472_1,"In order words, I found topics outside of my mentor's suiggestions and completed them based on my own initiative to succeed and bring news to Inside Clemson."
811,811_3,She has a team of employees and interns that she is responsible for and does a wonderful job empowering each of us and delegating work efficiently and smartly.
826,826_2,"Getting assignments done in a timely manner and communicating updates frequently.""
"
94,94_1,"In this way, I was able to gradually improve and expand my expertise.""
"
357,357_2,"This was the time where I encouraged discussion where individuals could share their point of view to achieve a common goal.
"
1271,1271_5,I took leadership and created content
844,844_1,"For instance, I'm better at coding than working at hardware, so I'm usually given the coding projects for the semester. ""
"
672,672_1,"Kathy, my mentor, gave me full independence in the project with the CA."
1161,1161_2,We would also discuss possible marketing ideas for how to get more students to go abroad to further reach our goal.
211,211_0,During my internship I was taught so many things about the dairy industry by a particular milk master who was very helpful and willing to share their information and experiences of the industry.
200,200_2,"What made the group successful was their sharing of a common goal, helping young women find their place in a STEAM field.""
"
727,727_1,"Dr. Moysey always encouraged but also questioned them in order to improve their research.
"
556,556_1,"Producing for NFL Films is strenuous and taxing job and requires meetings and guidance every day.
"
152,152_0,Building a relationship is so important when you are housed with 9 others.
1265,1265_2,I assisted in giving the three of us a vision of what the design was to look like and what we were working towards.
869,869_4,"And words will never describe how grateful I am for this wonderful opportunity.
"
39,39_3,"There was a constant need for relating small goals to global issues, particularly the global water crisis. ""
"
799,799_2,"Other times, I would lead by example, always looking for things to do and never being complacent.""
"
1066,1066_1,"Thus, our boss entrusted Antonio and I with a lot of responsibility and gave us the freedom to take our tasks in any direction in which we felt best."
1033,1033_0,"Sitting in on drop-in counseling appointments with several different counselors allowed me to observe how they connect and encourage students of different skills and backgrounds.
"
938,938_2,"It was really cool to watch a bunch of people come together to achieve the same vision. ""
"
1235,1235_1,"Also, I would follow-up with them after to get better insight into their thoughts.""
"
350,350_2,"They needed to know I was grateful for their help and that they were doing a great job, and that their ideas were greatly appreciated and helped us move past any hiccups.""
"
250,250_0,"""During one of our regular project meetings, the project manager was providing update on the project progress and receiving feedback from the team."
393,393_3,"We also worked with our committee so that they would help out with the project as well.""
"
811,811_2,so she has lots to look after.
753,753_3,"i was happy to be a part of these conversations and encourage them to talk it out and see what they liked better!""
"
1271,1271_2,I mentioned this to my mentor and she gave me full responsibility to do whatever I wanted with it.
1325,1325_0,"""While working in the Tiger Media office, my colleagues and I would often have discussions about the work we were doing."
129,129_0,At the conclusion of my internship I led the CCIT Visualization intern group in demonstrating virtual reality equipment in the Immersive Space to five groups of students in the Emerging Scholars program over three days.
1082,1082_4,"I aligned the objective of getting the """"study abroad experience"""" out to the freshmen engineers by giving my personal experience along with the broader organization of the Study Abroad Office's presentation.""
"
356,356_3,"I also made sure that everyone was in agreement on the final ideas for the festival.""
"
853,853_2,"This aligns with the Extension goal of providing the community with information that improves their lives.
"
672,672_0,"""I worked with a Career Ambassador to share information on recorded interviews to students."
955,955_1,I also asked the production supervisor if itÕs possible that an operator from the line could join the meeting because ultimately they are the end users of this instructions.
