ID,PID,Text
155,155_0,"""By preparing and planning our parking utilization study, I set up my fellow interns for success, ensuring that they could use the data collection sheets with ease and not have to worry about errors."
980,980_2,"He trusts individuals strengths and help them to grow their skills and talents.
"
23,23_0,A specific example is one of the interns asked about how it can encode and decode structures into a JSON object.
271,271_0,"""During the AFP National Philanthropy Day 2017 I felt a sense of leadership as I was in charge of paying attention to the Run of Show script and advancing the slides as well as helping Bethany set up the audio, video and monitors at the actual event."
699,699_1,"We would describe difficulties we were having and then we would all discuss how we could solve/combat these difficulties and move forward in our work. ""
"
937,937_2,"It was so important to hear from students that see the value in this practice being a """"tradition"""" as well as students who believe that its environmental consequences outweigh showmanship."
1284,1284_4,"I had to lean on him heavily for the questions related to being a Person of Color where as I could pull from my experience as a female for questions related to sexism.
"
410,410_0,I believe that many times throughout my internship experience supervisors would recognize the strengths of different researchers.
856,856_0,"""My responsibility includes answering emails for all the users that using this open source product -- indeed lot of people ask vague questions -- rather than immediately start to answer those vague questions, To lead the conversation, I'd like to provide them meaningful information of this product, in order to help us to converge to one or two specific questions."
1031,1031_0,"""Since the stated goal of the Watt Center was to provide a collaborative space for people to work on projects."
1200,1200_0,We had a wonderful group of leaders on my internship.
1244,1244_0,"""When delivering parent surveys at Greenville county schools, I had the opportunity to exhibit leadership."
71,71_0,"As an intern I have sat in on many meetings taking meeting minutes and have had multiple opportunities to hear bosses and coworkers converse and respect one another while differing in opinions to eventually reach a common ground.
"
921,921_1,"He used this opportunity to help develop her strength and enable her to practice and become more knowledgeable in calling tree height and using the proper tools to improve that ability.""
"
419,419_1,"It took over a month of setting schedules and editing it appropriately. ""
"
1168,1168_0,"Today I got one of my co-workers to agree to participate in a fundraising idea that I created.
"
966,966_1,"It was a very motivated teaching speech. ""
"
1271,1271_1,"We had not been utilizing the highlights or story features, which I saw as a good way to engage followers."
1295,1295_1,"As a writer, I often have to take the lead when it comes to my own articles and written pieces, but I find it easy to follow the lead of others when I am working on their project. ""
"
251,251_1,"This process helped me improve the design and ultimately helped achieve the common goal of completing the whole robot.
"
702,702_2,"I met with each team, listened to the different perspectives, and encouraged ways they could combine their idea together to take an even better direction.""
"
1212,1212_0,We have had to develop multiple social media contests for Campus Recreation.
1317,1317_5,We then sat around and talked about what we thought were some of the biggest issues and successes for the village.
240,240_1,"In these meetings, I have had to serve as a leader to push the students toward achieving some goal, such as acquiring the skills necessary to be successful in their courses. ""
"
1125,1125_0,"""This semester a group of mentors volunteered with Habitat for Humanity."
648,648_0,"I was offered an officer position in an adjoining organization related to my internship based on my leadership skills as I take the lead role on projects and delegate and ask for feedback.
"
1296,1296_0,When working on teams projects and in team meetings I would contribute ideas for how we could improve our proccesses and efficiency.
252,252_0,"""During one project for my internship, I organized the collection of 1,000s of student's work into a portfolio for presentation."
1139,1139_1,Not Too LateÓ initiative and I spear-headed the campaign by bringing the vision to our group and getting input on how to best achieve it.
353,353_0,For one small project we were working on
401,401_1,"I took on the role to focus on visa applications and as a guide before and during the orientation process in Paris.
"
909,909_4,"Our supervisor does a good job of distributing the work so that each person's talents can really shine. ""
"
1274,1274_2,"I found this very helpful! ""
"
1089,1089_3,"Once a month, students can use their points to buy Clemson merchandise.""
"
619,619_1,"So I often served as a moderator in quite a few meeting, where I encouraged everyone to express their opinions so we could make sure our decisions were efficient and well informed. ""
"
140,140_6,"Then, I helped the board direct their thoughts about the upcoming semester in light of what our long term goals were determined to be."
972,972_1,"I had to make sure current Scholars were available and willing to assist with logistical aspects of the weekend.
"
1265,1265_0,"""When I was working on the dislinked link health check tool with my fellow two interns, there is one end goal product that we wanted to produce in the end."
1169,1169_3,We had a great conversation about aquaponics and its place in the South Carolina Agriculture.
969,969_1,"Because of that, each person has their own point of view based on their domain."
793,793_0,"Met deadlines
"
930,930_0,One of my projects during my internship was to mange rework on a part.
1226,1226_0,"We were all self managed projects which required a level of self leadership and responsibility.
"
817,817_1,One particular story that pertains to this interview question is my meeting with Dr. Rajedra Bordia (professor and chair of the materials science and engineering department) at the beginning of the semester.
595,595_0,I spent some time during this internship training another intern on how to perform weekly radiation surveys in Clemson labs.
250,250_1,"He was recognizing the strengths of each team member and knew exactly who has the strongest skills to overcome each hurdles they had encountered on their path to deliver the project to the customer.""
"
1101,1101_5,"While my supervisors were involved in conversation and the following investigation, they did not have to worry about the day to day tasks and were able to solve the crime with my help.""
"
828,828_0,My manager often had to instruct coworkers and me on what to do if he had to step away.
1097,1097_0,There is still alot of things that I need to learn about leadership because it is not something that comes naturally.
1345,1345_0,"""Working with other college students, I got an idea of their strengths and weaknesses and when I was put with those coworkers we would reassign our roles and duties based on each other's strengths. ""
"
951,951_0,"""One of the other interns, who I consider a good friend, often engaged with me on different styles and methods of completing an assignment."
61,61_0,"""As a merchandise associate for Disney, we are constantly reminded of our guest's high expectations and our dedication to courtesy."
840,840_3,Myself and two other staff members moved the stock around to make it easier for customers to find the travel and hydration offerings due to them being popular and a large source of revenue.
185,185_3,"We were then able to develop a solution that everyone agreed on and met the guidelines of the focus group.""
"
491,491_0,I have not had any experience with leadership this semester with UPIC.
1118,1118_1,"In these meetings we discuss how our mentees are doing and learn academic and life strategies to pass along to them.
"
32,32_1,"We received very positive feedback and enthusiasm from this group of stakeholders to continue encouraging our efforts.""
"
99,99_0,"""As PhD student, I work on the project with different researchers and published papers as first author in top-level conference."
490,490_0,"I have led training on how to better the incident report forum with current RA's and will be continuing those training to create a clear format to further ease the work of the hearing officers.
"
943,943_1,"Unfortunately, not much word has been disseminated and applications to this program is low."
467,467_0,"""I had to give a seminar presentation on the research my CI team and I did, and I was able to share lots of results from analyzing the data we were looking at and also share specific findings from certain group members. ""
"
1161,1161_0,"""Throughout the semester, all of the interns and mentors would meet as a group."
1100,1100_0,"""There was a problem with people taking chairs from the creative lounge and the interns having no place to sit at the table."
351,351_5,"I then divided the jobs among our group so that we could get everything done efficiently based on each person's skills.""
"
381,381_0,"I aligned the faculty of the SMCC to achieve the goal of future profitability by providing them with tools and resources to jumpstart their off campus consulting branch.
"
537,537_0,"""I led a social media content team composed of 3 Clemson students."
69,69_1,They are very set in their ways
1085,1085_2,"At the meeting, I made sure to bring in other pools of knowledge such as the head of operations and my mentor."
1206,1206_2,"In return, everyone listened and expressed concerns if the other person's ideas did not seem complete.""
"
189,189_1,"During those few hours, I made sure to keep the workflow going, despite the absence of the main staff for a short time. ""
"
22,22_1,I brought together 16 student volunteers to aid with multiple events on-campus.
495,495_0,"I have seen the managers at Campus Banner + Design lead their interns towards a complete design project from start to finish.
"
83,83_1,"At the beginning of the semester I had the opportunity to lead as I was given the responsibility to inform her of various things that were happening in our programs as well as teach her how to work our database that we use for participant data.""
"
379,379_0,"""I acted on behalf of Clemson internal communications when determining how to frame a story about Tiger Advocates."
1303,1303_1,I made sure that the tasks that needed to be accomplished that day were presented in detail so that they could be easily followed.
432,432_0,"I encourage discussion daily when I ask my coworkers about any improvements they would like to see in our department
"
1074,1074_0,"""The main example I have for this section deals with the vast amount of time and effort that went into editing, revising, and updating policies that were meant to help the staff remain efficient, safe, and adherent to the Joint Commission standards.""
"
1069,1069_1,"I dug into the root cause and trained the people working on that section to prevent the occurrence in the first place, thus achieving the common vision of Lean Manufacturing""
"
275,275_0,"""During the course of my internship, there were many times where discussion was encouraged, especially during the pre-production phase of projects."
840,840_0,"""My mentor is involved in managing several enterprises so he was often out at other businesses or in meetings."
133,133_2,"We were both in charge of four coloring pages, which made the task more achievable.""
"
274,274_1,"I talked to the maintenance technicians who fixed the various issues on the machine , the line Engineer who designs the processes for the line, the Original Equipment Manufacturer who sold the machining equipment to ZF Transmissions to understand why certain aspects of the machine was designed the way it was."
791,791_2,"We, in a sense, divide and conquer the huge list of tasks that need to be done and all continue to learn new things along the way. ""
"
336,336_2,"If it was, a committee would be formed and the members of said committee would be responsible for executing the solution."
1285,1285_1,"I let them do their own work and was simply a guiding hand for them in case they got stuck.
"
1085,1085_5,"The Pro Benefits Expo was a huge success, and the client along with his department has said that they will be working with us on all future events.""
"
1215,1215_0,"""We have monthly department meeting during the intern."
274,274_2,"After zeroing in on a root cause, I had to assign an action plan to each party involved."
1209,1209_0,"""We have a lot of groups come in to use both the video and audio studios, and if they have questions, they will come to the interns."
931,931_0,One of my responsibilities is to train the new ambassadors.
384,384_0,"I am able to communicate group accomplishments to the board of trustees indirectly by helping prepare quarterly updates from Lean team members.
"
988,988_2,Our supervisor would demonstrate the importance of no backing by giving examples of industrial backing accidents.
112,112_3,"I may have worked in production, but everyone was confident in my designing abilities and asked me for constructive criticism. ""
"
821,821_2,Most of my interactions with Mr. Babb came from our Monday morning staff meetings.
1134,1134_1,"She assigns tasks and make suggestions based on what she knows about each of the interns but also challenges them so they have the opportunity to grow and learn something new.""
"
1059,1059_3,She leads the postdoc community well and they all appreciate her greatly.
917,917_4,"She developed a plan for how each of us would be involved in the department. ""
"
734,734_0,In the beginning of the semester we set smart goals and periodically throughout the semester we would check them.
772,772_1,"For example, I lead an information session on group fitness classes for the orientation ambassadors."
1350,1350_0,"""ZF has a large number of interns,and sometimes you need an intern from different department to work with you in a project, so communicating with different teams, understanding the functioning and achieving a common goal is what you go through every day in ZF."""
983,983_2,He helped us bring our ideas together to form one coherent project with dual aspects.
786,786_3,"However, she told me that although you might have critics, it's important to express your opinion and engage in express different points of view.""
"
212,212_1,I had to find articles for the team to read and answer questions about.
1211,1211_3,and I worked on a sensory night so people with sensory needs could attend.
81,81_2,A huge part of this process was making sure that embassy employees knew what the system was and how to use it.
1012,1012_0,"See previous response about coordinating robotics workshop
"
1110,1110_0,"""there wasn't really an opportunity to """"lead"""" however I was the most senior in the photography position""
"
405,405_5,"I was told that I did well keeping up with the rest of the class by answering questions and collaborating. ""
"
1099,1099_1,"I suggested that we delegate and split up, with me doing the duties that I could perform on my own without the vet's direct guidance."
651,651_0,"""I was privileged to sit in on several team meetings this semester, and I thought that every individual on my team did a good job of recognizing the strengths of their coworkers."
875,875_2,"Since the Research-to-Policy Collaboration works on an array of social issues, interns have the opportunity to choose to work on a topic that they already feel passionate about or one that they've been wanting to explore but haven't had the chance; a topic of which they are experts or one that they want to learn about."
959,959_4,"Through controlling the meeting both through the agenda and the length of topical discussions, in one meeting, the group was able to come to decisive choices on the intake forms. ""
"
1067,1067_2,"In the end I had settled on a plug-load monitor which was more expensive than we had preferred but would reliably accomplish this goal.""
"
260,260_0,During our weekly group meetings mentees would often come to us saying that they can't handle a certain class because it was never their strongest area in high school (mostly heard this about english class).
716,716_0,"""In my role I have served as the head strategist for the Clemson Immersive Space, so I set goals for branding, operations, and outreach."
108,108_1,"I worked with other girls to direct roles and make sure every task was fulfilled.""
"
448,448_1,Students are nominated by staff.
554,554_0,"""I noticed that during my internship, my mentor Tullen did a great job of helping capitalize on everyone's unique strengths."
901,901_0,"""On couple of occasions, I came up with some plans which were different from what my mentor was envisaging, and those ideas were slightly more far-sighted."
1326,1326_0,"""While working on chemical testing of hoses for pressure tanks, there were a number of parameters which were vague and not considered."
281,281_0,"""During the internship I was always eager to get those around me engaged in conversation."
59,59_0,"""As a member of the HR Engagement Committee, I encouraged others to take a well-rounded approach to getting to know there colleagues and giving back to the greater Clemson community."
263,263_1,I had a clear vision of what we were to accomplish and made sure that there was synergy within the group.
811,811_0,"""My boss Rosie is an incredible leaders, she handles the business development side of Trinity Sport."
323,323_0,Every meeting there are decisions that need to be taken.
550,550_1,Another idea that I had was to implement the Instagram story to sell Comfort Color Study Abroad t-shirts.
1331,1331_0,"""While writing a story about the Virtual Reality Club, I encouraged the people I was interviewing to voice their opinions and their concerns about the VR Club's portrayal on Newsstand."
12,12_5,"By sharing their thoughts, they were able to connect with each other and feel united by their feelings. ""
"
673,673_0,"I worked with a fellow intern to help assist me in writing some code for the open nms system.
"
169,169_0,"""Currently at the Watt Center, we are undergoing preparations for the """"Watson-In-The-Watt"""" joint initiative with IBM to bring collaboration, creation, and unique perspectives to advanced computational technology."
981,981_0,Our mentor appreciated and respected that I was a nutrition major and the other intern was a psychology major.
161,161_0,"""Coming directly from the collaboration answer, I was in charge of leading the communication and collaboration of our teams. ""
"
798,798_1,"I provided valuable inputs to assist them in making changes for making the work of interns more efficient.
"
834,834_2,AND I LOOK
1261,1261_0,"""When I presented on a dissection of a product line, most of the presentation was discussion between the audience with each person giving their own point of view.""
"
1302,1302_0,"""When writing a paper, my supervisor did a fantastic job of gathering the opinions of everyone involved in the project."
131,131_1,In the beginning each one sat down with me and we developed a schedule that best fits their needs on the projects as well as my needs as a student taking 10 credits of classes.
1343,1343_3,"Kinda seemed like a high school situation. ""
"
313,313_2,"While we produce the graphic image of the phrase, theme, or idea, he enstills it in the players."
378,378_11,The producer has consistently seen much lower populations of internal parasites after applying these methods of rotational grazing.
1021,1021_0,"Since I have been here the longest interns were always coming to me for questions or advice
"
840,840_6,"We hoped this would increase the chances of a product catching a customer's eye.""
"
1297,1297_2,"I suggested doing a graph through excel to make it understandable to people and he agreed that would be a smart idea.
"
904,904_8,"To compromise, we decided to split up the other volunteer groups but keep the family together."
11,11_2,We had a group discussion about what each person thought they could do to help the other with their idea and delegated tasks that we could do to help each other.
1093,1093_2,Some of them then planned to study abroad in the summer or in future semesters at Clemson.
256,256_0,During our meetings we discuss our ideas and go back and forth to listen to each other's thoughts and opinions.
1228,1228_1,"I spent most of the first few weeks training her on tasks, answering any questions she had to the best of my ability, and even began certain tasks that I knew were coming up."
174,174_3,I always had the liberty to speak up for any situation and put in my ideas as well.
1135,1135_2,"I had to make them interested in my project in order to talk to me about it.""
"
692,692_0,"""In a meeting with my fellow interns and supervisor, I suggested that instead of holding weekly workshops, we do bi-monthly workshops and have armark cater the events. ""
"
264,264_0,During out monthly internship meetings I encouraged the group of interns to come up with several ways to fundraise for the Clemson Study Abroad Office.
646,646_3,"Plus, I know I will help more in the future. ""
"
1170,1170_0,"""Towards the end of my internship, our office was getting new carpet."
115,115_3,"we know that we are doing a good job at what we are doing. ""
"
791,791_0,"""Many times we have large lists of things to do before a seminar or trial."
716,716_1,I have led a staff team of four students (including myself) in establishing consistent operating hours and procedures in the Immersive Space.
829,829_1,"We contributed our ideas, and I contributed mine and was open to change."
929,929_0,"""One of my goals for this semester was to create opportunities for the students attending the Business in Paris program to get to know one another before actually arriving in Paris."
458,458_1,I spent the entire day with a large group of about 30-40 people.
922,922_0,"""One day, all of our supervisors were participating in an OGE training, so there were only interns in the office."
1215,1215_3,I feel the meeting went out very successfully.
394,394_0,I am the main channel for the students to talk to about the study abroad program.
21,21_5,"we landed on letting the Buildings Lieutenant video her route and post it to our collective google drive so that we could have standards set. ""
"
1264,1264_0,"""When I was asked if there were any ideas I had for one of the Instagram accounts, I suggested reorganizing their story highlights and adding cover images to each."
711,711_0,"""In my internship, I came across information for a grant application from Johnson&Johnson about nursing technology and innovation."
55,55_2,"Once a tract is cruised, we have to take all the data and determine the value based on valuation trends and volumes."
689,689_0,"""I've seen how my mentor and his boss, Dustin, facilitate discussion in meetings with others in CCIT."
656,656_3,"I had to pitch how this purchase would enable individuals in our office to further excel at their positions.
"
932,932_0,One of my roles in project management is to help groups develop a scope and tasklist for their projects.
573,573_4,"I was still inexperienced but was invited on the project precisely for that reason - to provide an unbiased perspective and ask questions that those more experienced might not consider.""
"
873,873_1,I had a big problem with learning the steps of production and mastering the production processes.
906,906_0,"""On that day that the power went out, Mark had to get us all together and tell us what needed to be done once we found out which computers where actually down. ""
"
787,787_0,"""Many of the other student workers would ask me what there was today, and we would all work together to accomplish goals."
1002,1002_0,"Please see my answer for question 24.
"
560,560_3,This site visit would potentially improve team membersÕ understanding of different business and customer needs.
691,691_2,"Additionally, every mandatory meeting we had with the entire group I would synthesize the work we had done for the social media team that week to our UPIC Mentors and what we had in store for the next week. ""
"
547,547_0,"I made and designed various surveys for current National Scholars to collect information for the NSP directors to use for programmatic purposes.
"
1060,1060_0,"""The department put on the Recyclemania competition at Clemson this year and also organized the Zero Waste Game in coordination with Recyclemania and I played a large role in organizing the events that went along with it."
387,387_1,He always presents the issue with respect to those around the issue and/or those who could be impacted by it.
1095,1095_1,"I created a solution to the problem, presented it with the engineers and decided to lead the project.""
"
968,968_2,"Throughout these projects, I encouraged the other members to discuss any problems that they had with my decisions and told them that I was willing to change any decisions if the group felt it was best."
650,650_0,"I was preparing a meetings for our group with the scientists that we collaborated with and sometimes I had to lead the meeting and discussion.
"
241,241_1,I have been able to hold events where we are able to talk about fitness and health.
45,45_0,"""Almost every day I would discuss the daily routines with my fellow team members."
1224,1224_1,"They ultimately needed to design a project that fixed water issues, so it was awesome to facilitate a conversation where they all got to brainstorm ideas.""
"
154,154_0,"By meeting with subcontractors on site to coordinate repairs of storm sewer after testing had failed.
"
